product_name,price,stock,category_name,sku
Shiseido Benefique UV-AA Deep Block Essence 50ml (Sunscreen Lotion for Face & Body),3080,2,Beauty & Personal Care,SHISEIDO BENEFIQUE UV-AA DEEP BLOCK ESSENCE 500354
Shiseido Maquillage Dramatic Skin Sensor Base EX Natural 25ml Makeup Primer,2280,2,Cosmetics,SHISEIDO MAQUILLAGE DRAMATIC SKIN SENSOR BASE 0355
OMRON HEM-7120 Automatic Upper Arm Blood Pressure Monitor,4630,2,Health Monitor,OMRON HEM-7120 AUTOMATIC UPPER ARM BLOOD PRESS0356
Calorie Limit 90 Servings (30 Servings x 3 Bags Set) FANCL Beauty Diet,3990,1,Dietary Supplement,CALORIE LIMIT 90 SERVINGS (30 SERVINGS X 3 BAG0357
Stomach 60 Tablets Pillbox Japan Functional Display Food,1300,1,Health Supplement,STOMACH 60 TABLETS PILLBOX JAPAN FUNCTIONAL DI0358
Spa Treatment HAS Stretchy Eye Masks 60 Sheets,2797,1,Beauty & Personal Care,SPA TREATMENT HAS STRETCHY EYE MASKS 60 SHEETS0359
Shiseido Fine Today Facial Cleansing Specialist All Clear Oil 230ml,900,6,Skincare,SHISEIDO FINE TODAY FACIAL CLEANSING SPECIALIS0360
Aqua Label Special Gel Cream N (Moist) 90g,1560,5,Skincare,AQUA LABEL SPECIAL GEL CREAM N (MOIST) 90G0361
"FANCL Calorie Limit, Approximately 30 Servings, 3 Bags, Diet Supplement, Free Shipping, High Calorie",3980,1,Other,"FANCL CALORIE LIMIT, APPROXIMATELY 30 SERVINGS0362"
Lion Medicated Deoco Body Cleanser Refill 250ml,563,1,Health and Beauty,LION MEDICATED DEOCO BODY CLEANSER REFILL 250M0363
Pillbox Japan Onaka 60 Tablets (Shipping may take a few days),1278,3,Health Supplements,PILLBOX JAPAN ONAKA 60 TABLETS (SHIPPING MAY T0364
Shiseido Professional Adenovital Eye Lash Serum 6g,1358,6,Beauty/Cosmetics,SHISEIDO PROFESSIONAL ADENOVITAL EYE LASH SERU0365
Max Hyaluronic Acid 8 Piece Set Beauty Supplement with Hyaluronic Acid and Collagen,9288,1,Health Supplement,MAX HYALURONIC ACID 8 PIECE SET BEAUTY SUPPLEM0366
Shiseido Elixir Superieur Lift Moist Mask W 30mL×6 sheets (Sheet Mask),2337,1,Beauty/Cosmetics,SHISEIDO ELIXIR SUPERIEUR LIFT MOIST MASK W 300367
Shiseido Elixir Superieur Enriched Serum CB (Beauty Dense Liquid),7012,1,Skincare,SHISEIDO ELIXIR SUPERIEUR ENRICHED SERUM CB (B0368
Shiseido Elixir Superieur Lift Night Cream W 40g,4580,2,Skin Care,SHISEIDO ELIXIR SUPERIEUR LIFT NIGHT CREAM W 40369
Shiseido Elixir Superieur Moist In Cleansing 140ml Facial Cleanser,1580,3,Skincare,SHISEIDO ELIXIR SUPERIEUR MOIST IN CLEANSING 10370
Lactis Probiotics Supplement Drink 30 Days 16 Strains,7800,2,Supplements,LACTIS PROBIOTICS SUPPLEMENT DRINK 30 DAYS 16 0371
Ito En Oh-i Ocha Uji Matcha Brown Rice Tea 200g x 20 Bags Japanese Green Tea,5880,1,Food,ITO EN OH-I OCHA UJI MATCHA BROWN RICE TEA 2000372
"Papazee 5 by Oki Pharmaceutical, 120 Tablets",1353,5,Other,"PAPAZEE 5 BY OKI PHARMACEUTICAL, 120 TABLETS0373"
Deoco Medicinal Body Cleanser Refill (250ml),678,6,Health and Beauty,DEOCO MEDICINAL BODY CLEANSER REFILL (250ML)0374
Fine Today Shiseido Urea 10% Hand Cream (100g),546,1,Skin Care,FINE TODAY SHISEIDO UREA 10% HAND CREAM (100G)0375
"20x Maca + 100x Tonkat Ali King Power, 3-Month Supply, Zinc, Suppon, Arginine, Citrulline Supplement for Men",1999,1,Other,"20X MACA + 100X TONKAT ALI KING POWER, 3-MONTH0376"
"Natto Kinase Supplement [3-Piece Set] with Monacolin, Quercetin, and Garlic Extract",4439,5,Other,NATTO KINASE SUPPLEMENT [3-PIECE SET] WITH MON0377
Maruman Shark Cartilage Granules 90 pieces,2025,6,Health Supplement,MARUMAN SHARK CARTILAGE GRANULES 90 PIECES0378
Touchi Bean Extract Tablets 240 Tablets 6 Sets Free Shipping,6174,2,Health Supplement,TOUCHI BEAN EXTRACT TABLETS 240 TABLETS 6 SETS0379
Spa Treatment HAS Stretchy Eye Masks 60 Sheets,2797,1,Beauty & Personal Care,SPA TREATMENT HAS STRETCHY EYE MASKS 60 SHEETS0380
Shiseido Elixir Lufure Balancing Face Milk SPF50+ PA++++,1675,2,Skincare,SHISEIDO ELIXIR LUFURE BALANCING FACE MILK SPF0381
Meishoku Cosmetics DET Clear Bright & Peel Peeling Jelly Aging Care 180ml,1060,6,Skincare,MEISHOKU COSMETICS DET CLEAR BRIGHT & PEEL PEE0382
Deoco Medicinal Body Cleanser Refill (250ml),678,1,Health and Beauty,DEOCO MEDICINAL BODY CLEANSER REFILL (250ML)0383
Deoko Medicinal Deodorant Roll-On Type (30ml*5 set),4702,1,Health and Beauty,DEOKO MEDICINAL DEODORANT ROLL-ON TYPE (30ML*50384
Cedus Hair Care Brush Large Size SEN-705 Ikeмото Bürstenindustrie,539,1,Hair Care Accessories,CEDUS HAIR CARE BRUSH LARGE SIZE SEN-705 IKEМО0385
Maruman Shark Cartilage Granules 90 pieces,2025,6,Health Supplement,MARUMAN SHARK CARTILAGE GRANULES 90 PIECES0386
BCL Savoryno Moisturizing Eye Mask Sakura Scent,1430,5,Beauty Care,BCL SAVORYNO MOISTURIZING EYE MASK SAKURA SCEN0387
Pillbox Japan Onaka 60 Tablets,1278,2,Health_Supplement,PILLBOX JAPAN ONAKA 60 TABLETS0388
"Natto Kinase with Monacolin and Quercetin Extract, 8 tablets per day, 240 tablets, Supplement",4439,5,Other,NATTO KINASE WITH MONACOLIN AND QUERCETIN EXTR0389
Ikemoto Aging Care Scalp Brush TC1300,1050,3,Health & Beauty,IKEMOTO AGING CARE SCALP BRUSH TC13000390
Made in Japan Protective Power Amino Acid TOUAMIT 5-ALA Supplement Arashield,1119,2,Supplement,MADE IN JAPAN PROTECTIVE POWER AMINO ACID TOUA0391
Luber Natural Hair Soap with Marigold 720ml,1799,1,Hair Care,LUBER NATURAL HAIR SOAP WITH MARIGOLD 720ML0392
"Marathon Sale Limited 30% OFF Neck Massager with Heat EMS for Relaxation & Straightening, Smartphone Neck Relief with 1-Year Warranty, belulu Relaxbe Gift, Health & Medical Device for Shoulder & Neck Pain",8380,2,Other,MARATHON SALE LIMITED 30% OFF NECK MASSAGER WI0393
"Marathon Sale Limited 30% OFF Neck Massager with Heat EMS for Relaxation & Straightening, Smartphone Neck Relief with 1-Year Warranty, belulu Relaxbe Gift, Health & Medical Device for Shoulder & Neck Pain",8380,2,Other,MARATHON SALE LIMITED 30% OFF NECK MASSAGER WI0394
Orihiro Deep Sea Shark Liver Oil 100% Capsules 360 Tablets 60 Days Supply,3980,1,Health Supplement,ORIHIRO DEEP SEA SHARK LIVER OIL 100% CAPSULES0395
Shiseido Aqualabel Special Gel Cream A Oil-In 90g,1615,3,Skincare,SHISEIDO AQUALABEL SPECIAL GEL CREAM A OIL-IN 0396
Belulu EyeRefle 55% Off Hot Eye Mask Massager,6660,1,Health & Beauty,BELULU EYEREFLE 55% OFF HOT EYE MASK MASSAGER0397
Beauty Marathon 50% OFF Belulu Classy Facial Device Ultrasonic Ion Introduction Ion Extraction LED Light Therapy Rechargeable Skin Care Pore Cleansing,5990,1,Beauty & Personal Care,BEAUTY MARATHON 50% OFF BELULU CLASSY FACIAL D0398
AquaRufa Ultrasound Water Peeling Facial Cleanser Device,3590,3,Skincare Device,AQUARUFA ULTRASOUND WATER PEELING FACIAL CLEAN0399
Clinique High Impact Lash Elevating Mascara,2790,1,Cosmetics,CLINIQUE HIGH IMPACT LASH ELEVATING MASCARA0400
Paul Mitchell Full Circle Leave-In Treatment Hydrate Curl Control Frizz 200ml Hair Care,2910,1,Hair Care,PAUL MITCHELL FULL CIRCLE LEAVE-IN TREATMENT H0401
Deoko Medicinal Deodorant Roll-On Type (30ml*5 set),4702,1,Health and Beauty,DEOKO MEDICINAL DEODORANT ROLL-ON TYPE (30ML*50402
HR100BL Hyaluronic Acid Infusion Damage Care Styling Brush,873,9,Hair Care,HR100BL HYALURONIC ACID INFUSION DAMAGE CARE S0403
Max Hyaluronic Acid 8 Piece Set Beauty Supplement with Hyaluronic Acid and Collagen,9288,1,Health Supplement,MAX HYALURONIC ACID 8 PIECE SET BEAUTY SUPPLEM0404
Ogi Pharmaceutical Papain Z 5 120 tablets,1353,5,Health_Supplement,OGI PHARMACEUTICAL PAPAIN Z 5 120 TABLETS0405
Pillbox Japan Onaka 60 Tablets (Shipping may take a few days),1278,1,Health Supplements,PILLBOX JAPAN ONAKA 60 TABLETS (SHIPPING MAY T0406
OMRON HEM-7120 Automatic Upper Arm Blood Pressure Monitor,4630,2,Health Monitor,OMRON HEM-7120 AUTOMATIC UPPER ARM BLOOD PRESS0407
Shiseido Fino Premium Touch Hair Mask 230g,799,9,Hair Care,SHISEIDO FINO PREMIUM TOUCH HAIR MASK 230G0408
Reiwa Early Bird Sale Fine Today Shiseido Fino Premium Touch Penetrating Beauty Liquid Hair Mask 230g (Rinse-out Treatment) with Elegant and Comfortable Grace Floral Scent,777,1,Hair Care,REIWA EARLY BIRD SALE FINE TODAY SHISEIDO FINO0409
Belulu Aqualpha KRD-1027D/WT Water Peeling White,3780,1,Beauty Device,BELULU AQUALPHA KRD-1027D/WT WATER PEELING WHI0410
Belulu Aqualpha KRD-1027D/WT Water Peeling White,3780,1,Beauty Device,BELULU AQUALPHA KRD-1027D/WT WATER PEELING WHI0411
Pillbox Japan Onaka 60 Tablets (Shipping may take a few days),1279,1,Health Supplements,PILLBOX JAPAN ONAKA 60 TABLETS (SHIPPING MAY T0412
Shiseido Tsubaki Premium Moist Shampoo Refill 330ml,488,3,Hair Care,SHISEIDO TSUBAKI PREMIUM MOIST SHAMPOO REFILL 0413
Shiseido Tsubaki Premium Moist Hair Conditioner Refill 330ml,488,4,Hair Care,SHISEIDO TSUBAKI PREMIUM MOIST HAIR CONDITIONE0414
Ipokea EX 18ml x 3 Set Keratin Care Beauty Liquid for Rough Skin & Mole Removal,4703,3,Beauty/Skincare,IPOKEA EX 18ML X 3 SET KERATIN CARE BEAUTY LIQ0415
Shiseido Professional Adenovital Eye Lash Serum 6g,1475,5,Beauty/Cosmetics,SHISEIDO PROFESSIONAL ADENOVITAL EYE LASH SERU0416
Soft Santhia Eye Stretch Drop 5ml × 4 × 2 Sets with Finlayson Imabari Half Handkerchief,1580,1,Health & Beauty,SOFT SANTHIA EYE STRETCH DROP 5ML × 4 × 2 SETS0417
"Reusable 500 yen coupon, 5 times points, free shipping, Orihiro Night Diet Tea 10 set, 200 cups, about 35 yen per cup, orihiro, diet, diet tea, diet drink, amino acid, night diet",6990,1,Other,"REUSABLE 500 YEN COUPON, 5 TIMES POINTS, FREE 0418"
Kaminoose Shampoo for Medicinal Use (300ml*2 Set) [Kaminoose],2401,1,Hair Care,KAMINOOSE SHAMPOO FOR MEDICINAL USE (300ML*2 S0419
Shiseido Adenovital Shampoo 250mL (Non-Pharmaceutical),1589,5,Hair Care,SHISEIDO ADENOVITAL SHAMPOO 250ML (NON-PHARMAC0420
New Biofermin S Tablets 350 Tablets,1579,1,Health_Supplement,NEW BIOFERMIN S TABLETS 350 TABLETS0421
MTG Madonna MDNA Skin Onyx Black,9470,1,Skincare,MTG MADONNA MDNA SKIN ONYX BLACK0422
Dasmock B 80 Tablets Medication,2119,1,Health_Supplements,DASMOCK B 80 TABLETS MEDICATION0423
Usekin I (Eye Care) Set,3524,1,Health Supplement,USEKIN I (EYE CARE) SET0424
Usekin I (Eye Care) Set,3524,1,Health Supplement,USEKIN I (EYE CARE) SET0425
Fine Today Shiseido Hand Urea Series 10% Urea Cream Tube (60g),371,3,Skincare,FINE TODAY SHISEIDO HAND UREA SERIES 10% UREA 0426
Fine Today Shiseido Hand & Urea Series Urea Body Milk 150mL,420,3,Health and Beauty,FINE TODAY SHISEIDO HAND & UREA SERIES UREA BO0427
Fine Today Shiseido Hand Urea Series Urea 10% Cream (Jar) (100g),556,3,Skincare,FINE TODAY SHISEIDO HAND UREA SERIES UREA 10% 0428
"2021 Belulu Christmas Gift Set, No.1 on Rakuten, Reverse & Cosmetics Set, Facial Device, Cosmetics, Beauty Essence, Ultrasound, Skin Care, Present, Gift, Reward, Anti-Aging Care, EMS",11111,1,Other,"2021 BELULU CHRISTMAS GIFT SET, NO.1 ON RAKUTE0429"
Seduce Hair Care Brush SEN-705 Red,554,5,Hair Care,SEDUCE HAIR CARE BRUSH SEN-705 RED0430
Seduce Blue Brush SEN-705 Massaging Hair Care Brush,554,5,Hair Care,SEDUCE BLUE BRUSH SEN-705 MASSAGING HAIR CARE 0431
Shiseido Maquillage Dramatic Skin Sensor Base EX Natural 25ml Makeup Primer,2100,5,Cosmetics,SHISEIDO MAQUILLAGE DRAMATIC SKIN SENSOR BASE 0432
Kose Cosmeport Grace One Wrinkle Care Moist Gel Cream 100g,2420,6,Skincare,KOSE COSMEPORT GRACE ONE WRINKLE CARE MOIST GE0433
Sato Pharmaceutical Pamoxan Tablets 6 tablets,839,3,Pharmaceuticals,SATO PHARMACEUTICAL PAMOXAN TABLETS 6 TABLETS0434
Sato Pharmaceutical Pamoxan Tablets 6 tablets,699,3,Pharmaceuticals,SATO PHARMACEUTICAL PAMOXAN TABLETS 6 TABLETS0435
Enrich Plus Moisturizing Lotion,1870,1,Beauty_and_Personal_Care,ENRICH PLUS MOISTURIZING LOTION0436
Enrich Plus Lotion ＜Quasi-Drug＞ [FANCL Official] Collagen Moisturizing Toner for Dry Skin Care,1870,1,Health and Beauty,ENRICH PLUS LOTION ＜QUASI-DRUG＞ [FANCL OFFICIA0437
Shiseido Tsubaki Premium Moist Hair Conditioner Refill 330ml,488,1,Hair Care,SHISEIDO TSUBAKI PREMIUM MOIST HAIR CONDITIONE0438
Shiseido Tsubaki Premium Moist Shampoo Refill 330ml,488,6,Hair Care,SHISEIDO TSUBAKI PREMIUM MOIST SHAMPOO REFILL 0439
Intensive Moisturizing Liquid 230ml Grace One by Kose Cosmeport,1104,1,Skincare,INTENSIVE MOISTURIZING LIQUID 230ML GRACE ONE 0440
Usekin I (Eye Care) Set,3524,1,Health Supplement,USEKIN I (EYE CARE) SET0441
Usekin I (Eye Care) Set,3524,1,Health Supplement,USEKIN I (EYE CARE) SET0442
"Natto Kinase with Monacolin and Quercetin Extract, 8 tablets per day, 240 tablets, Supplement",4439,3,Other,NATTO KINASE WITH MONACOLIN AND QUERCETIN EXTR0443
Maruman Shark Cartilage Granules 90 pieces,2025,1,Health Supplement,MARUMAN SHARK CARTILAGE GRANULES 90 PIECES0444
Deep Sea Shark Extract Capsules (360 pieces),1987,1,Health Supplement,DEEP SEA SHARK EXTRACT CAPSULES (360 PIECES)0445
Japanese Candy Assortment (11 Pieces),322,2,Food,JAPANESE CANDY ASSORTMENT (11 PIECES)0446
"Touchi Bean Extract 240 Tablets, Set of 6, Free Shipping",5550,2,Other,"TOUCHI BEAN EXTRACT 240 TABLETS, SET OF 6, FRE0447"
"Touchi Bean Extract 240 Tablets, Set of 6, Free Shipping",5550,1,Other,"TOUCHI BEAN EXTRACT 240 TABLETS, SET OF 6, FRE0448"
Meiji Amino Collagen Standard 196g Mandomo Hydrating Skin Care Amicoll,1980,1,Health Supplement,MEIJI AMINO COLLAGEN STANDARD 196G MANDOMO HYD0449
Shiseido Elusive Supriel Enriched Wrinkle Cream L (22g) Shiseido Retino Vital Cream V,6775,1,Skincare,SHISEIDO ELUSIVE SUPRIEL ENRICHED WRINKLE CREA0450
Blue Ginseng Powder A/T 16 Packs,1757,1,Supplements,BLUE GINSENG POWDER A/T 16 PACKS0451
Shiseido Professional Adenovital Eye Lash Serum 6g,1475,6,Beauty/Cosmetics,SHISEIDO PROFESSIONAL ADENOVITAL EYE LASH SERU0452
"Amino Collagen Premium 28-Day Supply (2-Piece Set, 196g each)",5961,1,Other,AMINO COLLAGEN PREMIUM 28-DAY SUPPLY (2-PIECE 0453
Pillbox Japan Onaka 60 Tablets (Shipping may take a few days),1279,1,Health Supplements,PILLBOX JAPAN ONAKA 60 TABLETS (SHIPPING MAY T0454
Shield Lactobacillus Tablets Lemon Flavor,648,1,Supplement,SHIELD LACTOBACILLUS TABLETS LEMON FLAVOR0455
Pamoate Tablets (6 Tablets) Deworming Medication,710,1,Medicine/Supplements,PAMOATE TABLETS (6 TABLETS) DEWORMING MEDICATI0456
"Spirulina Ginkgo Leaf Supplement 1200 Tablets, Approximately 30 Days Supply, Superfood, Whole Food, for Vegetable Deficiency and Forgetfulness, by Swiss Linea Health Food Company",2116,2,Other,"SPIRULINA GINKGO LEAF SUPPLEMENT 1200 TABLETS,0457"
Pillbox Japan Onaka 60 Tablets (Shipping may take a few days),1279,1,Health Supplements,PILLBOX JAPAN ONAKA 60 TABLETS (SHIPPING MAY T0458
Shiseido Maquillage Dramatic Skin Sensor Base EX Natural 25ml Makeup Base,2100,5,Cosmetics,SHISEIDO MAQUILLAGE DRAMATIC SKIN SENSOR BASE 0459
Pamoxan Tablets (6 tablets) Over 20,730,3,Healthcare,PAMOXAN TABLETS (6 TABLETS) OVER 200460
Facial Steamer Belulu Rebirth B2 Skincare Set,9999,1,Skincare,FACIAL STEAMER BELULU REBIRTH B2 SKINCARE SET0461
Camellia Straight Hair Water 220ml,980,5,Hair Care,CAMELLIA STRAIGHT HAIR WATER 220ML0462
Cefine Beauty Pro Herb Clear Gel White & Clear,1408,5,Skincare,CEFINE BEAUTY PRO HERB CLEAR GEL WHITE & CLEAR0463
Relax Bee Neck Massager with Heat EMS for Shoulder Pain Relief and Smartphone Neck Strain,11980,2,Health and Beauty,RELAX BEE NECK MASSAGER WITH HEAT EMS FOR SHOU0464
Unlabel Lab V Essence Retinol 50mL,1760,3,Skincare,UNLABEL LAB V ESSENCE RETINOL 50ML0465
Micro Current Facial Device Kaxa-Lift S MARASIL,5880,1,Beauty Device,MICRO CURRENT FACIAL DEVICE KAXA-LIFT S MARASI0466
Natto Kinase Supplement with Monaco Lyne and Garlic Extract,4439,3,Health Supplement,NATTO KINASE SUPPLEMENT WITH MONACO LYNE AND G0467
Micro Current Facial Device Kaxa-Lift S MARASIL,5880,1,Beauty Device,MICRO CURRENT FACIAL DEVICE KAXA-LIFT S MARASI0468
Pamoxan Tablets (6 tablets) Over 20,730,3,Healthcare,PAMOXAN TABLETS (6 TABLETS) OVER 200469
Unlabeled Lab PL Essence Placenta 50mL,1540,3,Skincare,UNLABELED LAB PL ESSENCE PLACENTA 50ML0470
Facial Steamer Belulu Rebirth B2 Skincare Set,9999,3,Skincare,FACIAL STEAMER BELULU REBIRTH B2 SKINCARE SET0471
Waist Relax Functional Food 30 Days [FANCL Official],3290,1,Health Supplement,WAIST RELAX FUNCTIONAL FOOD 30 DAYS [FANCL OFF0472
"Third Class Medication, Nikobi Seirakuzai S Tablet 240 Tablets Set of 2",13999,1,Other,"THIRD CLASS MEDICATION, NIKOBI SEIRAKUZAI S TA0473"
"Kyoto Hanamai Geisha ""Sakura Shizuku 3dan Origami"" Folding Umbrella High-Grade Umbrella Sakura Pattern Appears when Wet Automatic Open and Close Umbrella Father's Day Gift Respect for the Aged Day Present",2380,1,Accessories,"KYOTO HANAMAI GEISHA ""SAKURA SHIZUKU 3DAN ORIG0474"
Cut Plus 1000 Resveratrol C 66g (30 packets) Free Shipping,4170,1,Supplements,CUT PLUS 1000 RESVERATROL C 66G (30 PACKETS) F0475
"Amino Collagen Premium 28-Day Supply (2-Piece Set, 196g each)",5961,1,Other,AMINO COLLAGEN PREMIUM 28-DAY SUPPLY (2-PIECE 0476
"Amino Collagen Premium 28-Day Supply (2-Piece Set, 196g each)",5961,1,Other,AMINO COLLAGEN PREMIUM 28-DAY SUPPLY (2-PIECE 0477
"Amino Collagen Premium 28-Day Supply (2-Piece Set, 196g each)",5961,1,Other,AMINO COLLAGEN PREMIUM 28-DAY SUPPLY (2-PIECE 0478
"Amino Collagen Premium 28-Day Supply (2-Piece Set, 196g each)",5961,1,Other,AMINO COLLAGEN PREMIUM 28-DAY SUPPLY (2-PIECE 0479
"Amino Collagen Premium 28-Day Supply (2-Piece Set, 196g each)",5961,1,Other,AMINO COLLAGEN PREMIUM 28-DAY SUPPLY (2-PIECE 0480
"Amino Collagen Premium 28-Day Supply (2-Piece Set, 196g each)",5961,1,Other,AMINO COLLAGEN PREMIUM 28-DAY SUPPLY (2-PIECE 0481
"Amino Collagen Premium 28-Day Supply (2-Piece Set, 196g each)",5961,1,Other,AMINO COLLAGEN PREMIUM 28-DAY SUPPLY (2-PIECE 0482
Meiji Amino Collagen Standard 196g Mandomo Hydrating Skin Care Amicoll,1980,5,Health Supplement,MEIJI AMINO COLLAGEN STANDARD 196G MANDOMO HYD0483
Pamoxan Tablets (6 tablets) Over 20,730,3,Healthcare,PAMOXAN TABLETS (6 TABLETS) OVER 200484
Seduce Blue Brush SEN-705 Massaging Hair Care Brush,554,5,Hair Care,SEDUCE BLUE BRUSH SEN-705 MASSAGING HAIR CARE 0485
Seduce Hair Care Brush SEN-705 Red,554,5,Hair Care,SEDUCE HAIR CARE BRUSH SEN-705 RED0486
Lululun Precious Face Mask Pack 64 Sheets,1430,5,Beauty_and_Personal_Care,LULULUN PRECIOUS FACE MASK PACK 64 SHEETS0487
ReFa Carat RAY RF-SR2150B Waterproof Microcurrent Beauty Device,9800,1,Beauty Device,REFA CARAT RAY RF-SR2150B WATERPROOF MICROCURR0488
Pamoxan Tablets (6 tablets) Over 20,730,3,Healthcare,PAMOXAN TABLETS (6 TABLETS) OVER 200489
Orihiro Low Molecular Hyaluronic Acid Collagen Bag 180g,1315,5,Health Supplement,ORIHIRO LOW MOLECULAR HYALURONIC ACID COLLAGEN0490
Yves Saint Laurent Rouge Pure Couture Vernis Vinyl Cream #402 Rouge Mix 5.5ml,2890,1,Cosmetics,YVES SAINT LAURENT ROUGE PURE COUTURE VERNIS V0491
Yves Saint Laurent Rouge Pure Couture Vernis Waterproof #602 Vague De Rouge Lipstick,3580,1,Cosmetics,YVES SAINT LAURENT ROUGE PURE COUTURE VERNIS W0492
Adidas Team Force EDT 100ml SP (Fragrance),650,1,Fragrance,ADIDAS TEAM FORCE EDT 100ML SP (FRAGRANCE)0493
"Collagen Drink 20000mg with Placenta, Made in Japan, Zero Fat, Zero Sugar, Non-Additive, Industry's No.1 Collagen Supplement",14415,1,Other,"COLLAGEN DRINK 20000MG WITH PLACENTA, MADE IN 0494"
Pillbox Japan Onaka 60 Tablets (Shipping may take a few days),1279,1,Health Supplements,PILLBOX JAPAN ONAKA 60 TABLETS (SHIPPING MAY T0495
Shiseido Elixir White Sleeping Clear Pack C 105g Non-Prescription Medicinal Product,2841,2,Skincare,SHISEIDO ELIXIR WHITE SLEEPING CLEAR PACK C 100496
Shiseido Maquillage Dramatic Skin Sensor Base EX Natural 25ml Makeup Base,2100,1,Cosmetics,SHISEIDO MAQUILLAGE DRAMATIC SKIN SENSOR BASE 0497
Shiseido Benefique UV-AA Deep Block Essence 50ml (Sunscreen Lotion for Face & Body),3080,1,Beauty & Personal Care,SHISEIDO BENEFIQUE UV-AA DEEP BLOCK ESSENCE 500498
Lebel Cool Orange Scalp Conditioner 240g Nozzle,102,2,Hair Care,LEBEL COOL ORANGE SCALP CONDITIONER 240G NOZZL0499
Luber Cool Orange Scalp Conditioner 240g x 5 Set,6602,1,Hair Care Product,LUBER COOL ORANGE SCALP CONDITIONER 240G X 5 S0500
Lebel Cool Orange Scalp Conditioner 240g Nozzle,102,5,Hair Care,LEBEL COOL ORANGE SCALP CONDITIONER 240G NOZZL0501
Omron HEM-7120 Automatic Upper Arm Blood Pressure Monitor,4378,2,Health and Wellness,OMRON HEM-7120 AUTOMATIC UPPER ARM BLOOD PRESS0502
Shiseido Fine Today Facial Cleansing Specialist All Clear Oil 230ml,900,1,Skincare,SHISEIDO FINE TODAY FACIAL CLEANSING SPECIALIS0503
FANCL Eye Supplement 90 Days,5550,1,Health Supplements,FANCL EYE SUPPLEMENT 90 DAYS0504
Pamoxan Tablets 6 pieces by Sato Pharmaceutical,1010,3,Pharmaceuticals,PAMOXAN TABLETS 6 PIECES BY SATO PHARMACEUTICA0505
Pamoxan Tablets 6 pieces by Sato Pharmaceutical,1010,3,Pharmaceuticals,PAMOXAN TABLETS 6 PIECES BY SATO PHARMACEUTICA0506
Lubel Matéria G1 Texture Shade Orange Beige OBe-7G 120g,746,1,Cosmetics,LUBEL MATÉRIA G1 TEXTURE SHADE ORANGE BEIGE OB0507
Lubell Matérica G1 Texture Shade Beige Be-7G 120g,746,1,Cosmetics,LUBELL MATÉRICA G1 TEXTURE SHADE BEIGE BE-7G 10508
Luber Material 2 Agent OxiW 3% 1000mL,1013,1,Hair Care Treatment,LUBER MATERIAL 2 AGENT OXIW 3% 1000ML0509
Lusheri Lift Glow Emulsion II Moisturizing (120ml),3300,1,Skincare,LUSHERI LIFT GLOW EMULSION II MOISTURIZING (120510
Lcheri Lift Glow Lotion II Rich Moisturizing (160ml),2970,1,Skincare,LCHERI LIFT GLOW LOTION II RICH MOISTURIZING (0511
"Free Shipping: Outlet Plant Enzyme Capsules 60 Pieces, 60 Days Supply, with Lactic Acid Bacteria, Orihiro, Best Before June 2022",980,5,Other,FREE SHIPPING: OUTLET PLANT ENZYME CAPSULES 600512
Facial Steamer Belulu Rebirth B2 Skincare Set,9999,2,Skincare,FACIAL STEAMER BELULU REBIRTH B2 SKINCARE SET0513
Ipokea EX 18ml x 3 Set Keratin Care Beauty Liquid for Rough Skin & Mole Removal,4703,2,Beauty/Skincare,IPOKEA EX 18ML X 3 SET KERATIN CARE BEAUTY LIQ0514
Esthe Pro Lab Herb Tea Pro Heat Enzyme Pro 30g (5-Piece Value Set),14660,1,Health Supplement,ESTHE PRO LAB HERB TEA PRO HEAT ENZYME PRO 30G0515
Usekin I (Eye Care) Set,3602,1,Health Supplement,USEKIN I (EYE CARE) SET0516
Maruman Shark Cartilage Granules 90 pieces,2025,1,Health Supplement,MARUMAN SHARK CARTILAGE GRANULES 90 PIECES0517
Ogi Pharmaceutical Papain Z 5 120 tablets,1353,5,Health_Supplement,OGI PHARMACEUTICAL PAPAIN Z 5 120 TABLETS0518
Micro Current Facial Lifter & Rejuvenator MARASIL Kaxa-Lift S 6005,5880,1,Beauty Device,MICRO CURRENT FACIAL LIFTER & REJUVENATOR MARA0519
Multivitamin & Mineral Supplement 90-day supply,2900,1,Health Supplement,MULTIVITAMIN & MINERAL SUPPLEMENT 90-DAY SUPPL0520
"Blood Sugar Support, 90 Days Supply, Functional Food Label",4150,1,Other,"BLOOD SUGAR SUPPORT, 90 DAYS SUPPLY, FUNCTIONA0521"
Red Koji & Plant Sterol Cholesterol Habit 90 Days [FANCL Official],4150,1,Health Supplement,RED KOJI & PLANT STEROL CHOLESTEROL HABIT 90 D0522
"Kyoto Hanamai Geisha ""Sakura Shizuku 3dan Origami"" Folding Umbrella High-Grade Umbrella Sakura Pattern Appears when Wet Automatic Open and Close Umbrella Father's Day Gift Respect for the Aged Day Present",2380,1,Accessories,"KYOTO HANAMAI GEISHA ""SAKURA SHIZUKU 3DAN ORIG0523"
Fine Okinawa Moromi + Nattokinase 30 Days Supply (450mg*90 Tablets),1231,5,Supplements,FINE OKINAWA MOROMI + NATTOKINASE 30 DAYS SUPP0524
Lebel Proedit Float Cleansing Shampoo,1027,2,Hair Care,LEBEL PROEDIT FLOAT CLEANSING SHAMPOO0525
Lebel Pro Edit Hairskin Float Cleansing 250ml with Exclusive Nozzle,91,2,Hair Care,LEBEL PRO EDIT HAIRSKIN FLOAT CLEANSING 250ML 0526
Unlabeled Lab PL Essence Placenta 50mL,1540,3,Skincare,UNLABELED LAB PL ESSENCE PLACENTA 50ML0527
Asahi Group Foods Asahi Super Beer Yeast Z 660 Granules,1178,1,Health Supplement,ASAHI GROUP FOODS ASAHI SUPER BEER YEAST Z 6600528
Orihiro Low Molecular Hyaluronic Acid Collagen Bag 180g,1315,5,Health Supplement,ORIHIRO LOW MOLECULAR HYALURONIC ACID COLLAGEN0529
Shiseido Funte Forte Adeno Vital Shampoo Refill 450ml for Men,2639,2,Hair Care,SHISEIDO FUNTE FORTE ADENO VITAL SHAMPOO REFIL0530
Shiseido Aqualabel Special Gel Cream A Oil-In 90g,1709,5,Skincare,SHISEIDO AQUALABEL SPECIAL GEL CREAM A OIL-IN 0531
Shiseido Aqua Label Special Gel Cream A (White) 90g Non-Prescription Drug,1584,5,Skincare,SHISEIDO AQUA LABEL SPECIAL GEL CREAM A (WHITE0532
Shiseido Aqua Label Special Gel Cream N (Moist) 90g,1584,5,Skincare,SHISEIDO AQUA LABEL SPECIAL GEL CREAM N (MOIST0533
"Kids Junior Sports Leggings 10cm Length, Japanese Made, Inner Contact Cooling, Quick Dry, UV Cut, Soccer Baseball Basketball Rugby Tennis Dance for Boys and Girls UPF50+",1680,1,Other,"KIDS JUNIOR SPORTS LEGGINGS 10CM LENGTH, JAPAN0534"
"Free Shipping, Same Day Shipping Available, PUMA Junior Compression Mock Neck Long Sleeve Shirt for Soccer, Futsal, Kids Inner Wear",3399,1,Other,"FREE SHIPPING, SAME DAY SHIPPING AVAILABLE, PU0535"
"Dasimock b 80 Tablets x 5 Set, Seihaito, Free Shipping, 2% Off Coupon",10695,1,Other,"DASIMOCK B 80 TABLETS X 5 SET, SEIHAITO, FREE 0536"
"Natto Kinase Supplement [3-Piece Set] with Monacolin, Quercetin, and Garlic Extract",4439,5,Other,NATTO KINASE SUPPLEMENT [3-PIECE SET] WITH MON0537
"Facial Steamer with Humidifier & Coupon Discounts, Awarded Rank 1, Free Shipping & 1 Year Warranty, Fine Mist for Hydration & Skincare",5930,1,Other,FACIAL STEAMER WITH HUMIDIFIER & COUPON DISCOU0538
Facial Steamer Belulu Rebirth B2 Skincare Set,9999,1,Skincare,FACIAL STEAMER BELULU REBIRTH B2 SKINCARE SET0539
Belulu Classy Facial Device: Ultrasonic Ion Introduction & Extraction LED Light Therapy Rechargeable Skin Care Pore Cleanser,5990,1,Beauty Device,BELULU CLASSY FACIAL DEVICE: ULTRASONIC ION IN0540
DHC Multi Mineral Supplement 90-Day Supply x 2 Packs (540 Tablets),2199,1,Health Supplement,DHC MULTI MINERAL SUPPLEMENT 90-DAY SUPPLY X 20541
Deonature Soft Stone W Anti-Perspirant Set,2970,2,Health and Beauty,DEONATURE SOFT STONE W ANTI-PERSPIRANT SET0542
Octocera Pie Medicinal Skin Care Shampoo,876,5,Hair Care,OCTOCERA PIE MEDICINAL SKIN CARE SHAMPOO0543
"Touchi Bean Extract 240 Tablets, Set of 6, Free Shipping",5550,2,Other,"TOUCHI BEAN EXTRACT 240 TABLETS, SET OF 6, FRE0544"
Shiseido Professional Adenovital Eye Lash Serum 6g,1475,6,Beauty/Cosmetics,SHISEIDO PROFESSIONAL ADENOVITAL EYE LASH SERU0545
Rohto Pharmaceutical Melano CC Medicated Spot Concentrated Serum 20ml Non-Prescription Medication,880,1,Beauty/Skincare,ROHTO PHARMACEUTICAL MELANO CC MEDICATED SPOT 0546
