product_name,price,stock,category_name,sku
"ReFa Face-Up Cream Set of 3, Anti-Aging Face Lifting Moisturizer",8250,1,Other,"REFA FACE-UP CREAM SET OF 3, ANTI-AGING FACE L0547"
Rohto Pharmaceutical Deoco Medicinal Deodorant Roll-on Type 30mL,716,2,Health & Beauty,ROHTO PHARMACEUTICAL DEOCO MEDICINAL DEODORANT0548
Spa Treatment HAS Stretchy Eye Masks 60 Sheets,2990,1,Beauty & Personal Care,SPA TREATMENT HAS STRETCHY EYE MASKS 60 SHEETS0549
"Shiseido Authentic Shop, Elixir Superieur Day Care Revolution T+, Star Post Parcel Size Exceeds Home Delivery",2310,1,Other,"SHISEIDO AUTHENTIC SHOP, ELIXIR SUPERIEUR DAY 0550"
Shiseido Authorized Dealer Elixir Superieur Moist In Cleanser,1579,1,Beauty/Cosmetics,SHISEIDO AUTHORIZED DEALER ELIXIR SUPERIEUR MO0551
Shiseido Authentic Store Elixir Superieur Sleeping Gel Pack W,2478,3,Skincare,SHISEIDO AUTHENTIC STORE ELIXIR SUPERIEUR SLEE0552
DHC Supplement Waist Concern 30 Days 60 Tablets x 3 Functional Food Health Supplement,5270,1,Health_Supplement,DHC SUPPLEMENT WAIST CONCERN 30 DAYS 60 TABLET0553
Lebel Pro Edit Careworks PPT NMF CMC Element Fix Set (150ml each) Hair Care Treatment Salon Exclusive Product,4730,1,Hair Care,LEBEL PRO EDIT CAREWORKS PPT NMF CMC ELEMENT F0554
Lebel Pro Edit Careworks Element Fix PPT NMF CMC Hair Care Treatment Nozzle,101,1,Hair Care,LEBEL PRO EDIT CAREWORKS ELEMENT FIX PPT NMF C0555
Lebel Pro Edit Careworks Element Fix PPT NMF CMC Trigger,198,3,Hair Care,LEBEL PRO EDIT CAREWORKS ELEMENT FIX PPT NMF C0556
Shiseido Professional Adenovital Eye Lash Serum 6g,1475,6,Beauty/Cosmetics,SHISEIDO PROFESSIONAL ADENOVITAL EYE LASH SERU0557
"Spirulina Coenzyme Q10 1200 Tablets, 30-Day Supply for Athletes, Multivitamin Supplement with Amino Acids, Alkaline Food, Nucleic Acid, Fasting Diet, High-Protein Health Food",2116,5,Other,"SPIRULINA COENZYME Q10 1200 TABLETS, 30-DAY SU0558"
Specified OTC Medicinal Product Usekin Bottle 120g,831,1,Health_Supplement,SPECIFIED OTC MEDICINAL PRODUCT USEKIN BOTTLE 0559
"Collagen Drink 20000mg with Placenta, Made in Japan, Zero Fat, Zero Sugar, Non-Additive, Industry's No.1 Collagen Supplement",14415,1,Other,"COLLAGEN DRINK 20000MG WITH PLACENTA, MADE IN 0560"
Pillbox Japan Onaka 60 Tablets (Shipping may take a few days),1279,2,Health Supplements,PILLBOX JAPAN ONAKA 60 TABLETS (SHIPPING MAY T0561
"Natto Kinase [Set of 3] with Monacolin and Quercetin Extract, Active Natto Kinase and Garlic Extract, 8 Tablets per Day, 240 Tablets, Dietary Supplement",4439,2,Other,NATTO KINASE [SET OF 3] WITH MONACOLIN AND QUE0562
Stomach 60 Tablets (15-day supply) Pill Box [Functional Display Food],1280,3,Supplements,STOMACH 60 TABLETS (15-DAY SUPPLY) PILL BOX [F0563
"FANCL Supplement for Men from 50s, 30 packs",3780,1,Other,"FANCL SUPPLEMENT FOR MEN FROM 50S, 30 PACKS0564"
Facial Steamer Belulu Rebirth B2 Skincare Set,9999,1,Skincare,FACIAL STEAMER BELULU REBIRTH B2 SKINCARE SET0565
Shiseido Fino Premium Touch Treatment 250g,1586,2,Hair Care,SHISEIDO FINO PREMIUM TOUCH TREATMENT 250G0566
Shiseido Fenteforte Shampoo 250ml,1274,2,Hair Care,SHISEIDO FENTEFORTE SHAMPOO 250ML0567
Shiseido Adenovital Advanced Scalp Essence 180ml [Quasi-drug],5863,2,Hair Care,SHISEIDO ADENOVITAL ADVANCED SCALP ESSENCE 1800568
Ikemoto Seduce Hair Brush (Red),620,5,Hair_Care_Accessories,IKEMOTO SEDUCE HAIR BRUSH (RED)0569
Ikemoto Aging Care Scalp Brush TC1300,1050,5,Health & Beauty,IKEMOTO AGING CARE SCALP BRUSH TC13000570
Ikemoto Seduce Hair Brush Blue,620,5,Hair Care,IKEMOTO SEDUCE HAIR BRUSH BLUE0571
Pamoxan Tablets 6 pieces,987,3,Pharmaceuticals,PAMOXAN TABLETS 6 PIECES0572
Belulu Classy Facial Device with Ultrasonic Ion Introduction and LED Cleansing,5990,1,Beauty Device,BELULU CLASSY FACIAL DEVICE WITH ULTRASONIC IO0573
Pamoxan Tablets 6 pieces,987,3,Pharmaceuticals,PAMOXAN TABLETS 6 PIECES0574
"Pamoxan Tablets 6 tablets, Sato Pharmaceutical, Over-the-Counter Medicine",987,3,Other,"PAMOXAN TABLETS 6 TABLETS, SATO PHARMACEUTICAL0575"
Shiseido Elixir Superieur Sleeping Gel Pack W 105g,2560,2,Skincare,SHISEIDO ELIXIR SUPERIEUR SLEEPING GEL PACK W 0576
Shiseido Elixir Superieur Lift Night Cream W 40g,4560,2,Skin Care,SHISEIDO ELIXIR SUPERIEUR LIFT NIGHT CREAM W 40577
Shiseido Elixir Advanced Skin Finisher 30ml (Day Cream SPF50+ PA++++),2300,2,Skincare,SHISEIDO ELIXIR ADVANCED SKIN FINISHER 30ML (D0578
"Papazell 5 120 Tablets, Second Class Pharmaceutical",1347,8,Other,"PAPAZELL 5 120 TABLETS, SECOND CLASS PHARMACEU0579"
"Spirulina Coenzyme Q10 1200 Tablets, 30-Day Supply for Athletes, Multivitamin Supplement with Amino Acids, Alkaline Food, Nucleic Acid, Fasting Diet, High-Protein Health Food",2116,2,Other,"SPIRULINA COENZYME Q10 1200 TABLETS, 30-DAY SU0580"
Collagen Tripeptide Spirulina Marine Collagen Low MolecularWeight Collagen Supplement Skin Care Fasting Diet Whole Food Protein Rich Health Food,1250,5,Health Supplement,COLLAGEN TRIPEPTIDE SPIRULINA MARINE COLLAGEN 0581
DHC Supplement Power Food Spirulina 30 Days Supply (270 Tablets) x 5 Sets,8075,1,Health Supplements,DHC SUPPLEMENT POWER FOOD SPIRULINA 30 DAYS SU0582
Lebel IAU Deep Essence Mask,2420,1,Beauty/Cosmetics,LEBEL IAU DEEP ESSENCE MASK0583
Lebel IAU Serum Oil Hair Treatment (100ml),2074,1,Beauty/Cosmetics/Hair Care,LEBEL IAU SERUM OIL HAIR TREATMENT (100ML)0584
Lebel IAU Essence FORTI (100ml) Mail Delivery Available,1606,1,Hair Care,LEBEL IAU ESSENCE FORTI (100ML) MAIL DELIVERY 0585
Lebel IAU Essence Moist 100ml,1628,1,Hair Care,LEBEL IAU ESSENCE MOIST 100ML0586
Luber Pro Edit Care Works Bounce Fit Shampoo & Treatment Set,2398,1,Hair Care,LUBER PRO EDIT CARE WORKS BOUNCE FIT SHAMPOO &0587
Lebel Pro Edit Careworks Through Fit Hair Treatment (250ml),1190,1,Hair Care Treatment,LEBEL PRO EDIT CAREWORKS THROUGH FIT HAIR TREA0588
Usekin I (Eye Care) Set,3422,1,Health Supplement,USEKIN I (EYE CARE) SET0589
Fine Today Shiseido Fino Premium Touch Hair Mask,778,6,Hair Care,FINE TODAY SHISEIDO FINO PREMIUM TOUCH HAIR MA0590
Shiseido Adenovital Shampoo 250mL (Non-Pharmaceutical),1589,4,Hair Care,SHISEIDO ADENOVITAL SHAMPOO 250ML (NON-PHARMAC0591
Facial Steamer Belulu Rebirth B2 Skincare Set,9999,1,Skincare,FACIAL STEAMER BELULU REBIRTH B2 SKINCARE SET0592
Shiseido Adenovital Shampoo 250mL (Non-Pharmaceutical),1589,6,Hair Care,SHISEIDO ADENOVITAL SHAMPOO 250ML (NON-PHARMAC0593
Octocera Pie Medicinal Skin Care Shampoo,876,5,Hair Care,OCTOCERA PIE MEDICINAL SKIN CARE SHAMPOO0594
"Natto Kinase Supplement [3-Piece Set] with Monacolin, Quercetin, and Garlic Extract",4439,2,Other,NATTO KINASE SUPPLEMENT [3-PIECE SET] WITH MON0595
Unimat Rekken Kid's Cod Liver Oil Drop Gummies 100 pieces,572,7,Supplements,UNIMAT REKKEN KID'S COD LIVER OIL DROP GUMMIES0596
Pillbox Japan Onaka 60 Tablets (Shipping may take a few days),1279,2,Health Supplements,PILLBOX JAPAN ONAKA 60 TABLETS (SHIPPING MAY T0597
Rohto Pharmaceutical Deoco Medicinal Deodorant Roll-On 30ml,726,1,Health and Beauty,ROHTO PHARMACEUTICAL DEOCO MEDICINAL DEODORANT0598
Fine Today Shiseido Fino Premium Touch Hair Mask,778,1,Hair Care,FINE TODAY SHISEIDO FINO PREMIUM TOUCH HAIR MA0599
Obagi Peeling V10 Essence (Makeup Remover Beauty Liquid) 180ml,4756,1,Skincare,OBAGI PEELING V10 ESSENCE (MAKEUP REMOVER BEAU0600
Shiseido Professional Adenovital Eye Lash Serum 6g,1475,6,Beauty/Cosmetics,SHISEIDO PROFESSIONAL ADENOVITAL EYE LASH SERU0601
"Spirulina Ginkgo Leaf Supplement 1200 Tablets, Approximately 30 Days Supply, Superfood, Whole Food, for Vegetable Deficiency and Forgetfulness, by Swiss Linea Health Food Company",2116,2,Other,"SPIRULINA GINKGO LEAF SUPPLEMENT 1200 TABLETS,0602"
Lebel Pro Edit Careworks Element Fix PPT NMF CMC Hair Care Treatment Nozzle,101,1,Hair Care,LEBEL PRO EDIT CAREWORKS ELEMENT FIX PPT NMF C0603
"2021 Summer Skin Care Lucky Bag with 4 Luxury Items: Face Mask, Lotion, Moisturizing Cream, and Facial Steamer",10000,1,Other,2021 SUMMER SKIN CARE LUCKY BAG WITH 4 LUXURY 0604
Belulu Classy Facial Device with Ultrasonic Ion Introduction and LED Cleansing,5990,1,Beauty Device,BELULU CLASSY FACIAL DEVICE WITH ULTRASONIC IO0605
Urea 10% Soft & Smooth Cream N 100g,618,1,Skincare Cream,UREA 10% SOFT & SMOOTH CREAM N 100G0606
Shiseido Elixir White Sleeping Clear Pack C 105g Non-Prescription Medicinal Product,2841,1,Skincare,SHISEIDO ELIXIR WHITE SLEEPING CLEAR PACK C 100607
Shiseido Maquillage Dramatic Skin Sensor Base EX Natural 25ml Makeup Base,2100,1,Cosmetics,SHISEIDO MAQUILLAGE DRAMATIC SKIN SENSOR BASE 0608
Shiseido Benefique UV-AA Deep Block Essence 50ml (Sunscreen Lotion for Face & Body),3080,2,Beauty & Personal Care,SHISEIDO BENEFIQUE UV-AA DEEP BLOCK ESSENCE 500609
Relax Bee Neck Massager with Heat & EMS for Shoulder and Neck Relief,9580,4,Health and Beauty,RELAX BEE NECK MASSAGER WITH HEAT & EMS FOR SH0610
Pabron Gold A Tablets 210 [Cold Medicine],1375,2,Pharmaceuticals,PABRON GOLD A TABLETS 210 [COLD MEDICINE]0611
Pabron Gold A Fine Granules 44 Packs [Cold Medicine],1375,2,Healthcare & Pharmacy,PABRON GOLD A FINE GRANULES 44 PACKS [COLD MED0612
Limited Time 62% OFF! Belulu AquaRufa Ultrasonic Water Peeling Facial Cleanser Device Ion Introduction & Extraction Blackhead Acne Removal Moisturizing Lifting Anti-Aging Wrinkle Pore Care Free Shipping & Return Guarantee,3000,3,Beauty Device,LIMITED TIME 62% OFF! BELULU AQUARUFA ULTRASON0613
Limited Time 62% OFF! Belulu AquaRufa Ultrasonic Water Peeling Facial Cleanser Device Ion Introduction & Extraction Blackhead Acne Removal Moisturizing Lifting Anti-Aging Wrinkle Pore Care Free Shipping & Return Guarantee,3000,3,Beauty Device,LIMITED TIME 62% OFF! BELULU AQUARUFA ULTRASON0614
Limited Time 50% OFF! Belulu AquaRufa Ultrasonic Water Peeling Facial Cleaner,3990,3,Beauty Device,LIMITED TIME 50% OFF! BELULU AQUARUFA ULTRASON0615
Neck Massager Relack Bee 20x Points Relaxing EMS Shoulder Warmer Health Gift,11980,1,Health & Beauty,NECK MASSAGER RELACK BEE 20X POINTS RELAXING E0616
"Spirulina 100% 2400 Tablets, Buy 6 Get 1 Free Supplement BCAA for Veggie Deficiency, Poor Eating Habits, Diet Aid, Superfood Health Food",12696,2,Other,"SPIRULINA 100% 2400 TABLETS, BUY 6 GET 1 FREE 0617"
"Unlabel Lab R Essence Retinol 50mL, Japanese Made, Ultra-High Pressure Infusion Type Beauty Serum for Dryness and Fine Wrinkles, Concentrated, Additive-Free",1760,5,Other,"UNLABEL LAB R ESSENCE RETINOL 50ML, JAPANESE M0618"
Unlabeled Lab PL Essence Placenta 50mL,1540,5,Skincare,UNLABELED LAB PL ESSENCE PLACENTA 50ML0619
"Unlabel Lab Essence Ceramide 50mL, Japanese High-Pressure Infusion Beauty Serum for Dry Sensitive Skin",1320,5,Other,"UNLABEL LAB ESSENCE CERAMIDE 50ML, JAPANESE HI0620"
Pabron Gold A Fine Granules 44 Packs [Cold Medicine],1375,2,Healthcare & Pharmacy,PABRON GOLD A FINE GRANULES 44 PACKS [COLD MED0621
Pabron Gold A Tablets 210 [Cold Medicine],1375,2,Pharmaceuticals,PABRON GOLD A TABLETS 210 [COLD MEDICINE]0622
Ipokea EX 18ml x 3 Set Keratin Care Beauty Liquid for Rough Skin & Mole Removal,4703,2,Beauty/Skincare,IPOKEA EX 18ML X 3 SET KERATIN CARE BEAUTY LIQ0623
Usekin I (Eye Care) Set,3422,1,Health Supplement,USEKIN I (EYE CARE) SET0624
"Unlabel Lab PL Essence Placenta 50mL, High-Pressure Infusion Concentrated Beauty Serum",1540,5,Other,"UNLABEL LAB PL ESSENCE PLACENTA 50ML, HIGH-PRE0625"
"Dasmock B 80 Tablets x 5 Set, Seihaito, Free Shipping, 2% Off Coupon, Second-Class Medicines",10695,2,Other,"DASMOCK B 80 TABLETS X 5 SET, SEIHAITO, FREE S0626"
Raspberry Red Waterlip Tinted Mentholatum,219,1,Cosmetics,RASPBERRY RED WATERLIP TINTED MENTHOLATUM0627
Rose Pink Water Lip Tone Up CC 4.5g by Mentholatum Rohto,240,1,Cosmetics,ROSE PINK WATER LIP TONE UP CC 4.5G BY MENTHOL0628
Pure Red Water Lip Tone Up CC,240,1,Cosmetics,PURE RED WATER LIP TONE UP CC0629
Urea 10% Soft & Smooth Cream N 100g,618,1,Skincare Cream,UREA 10% SOFT & SMOOTH CREAM N 100G0630
Natto Kinase Supplement with Monaco Lyne and Garlic Extract,4439,5,Health Supplement,NATTO KINASE SUPPLEMENT WITH MONACO LYNE AND G0631
Probability and Statistics for Technologists: Seriously Learning University Mathematics [Etsuji Nakai],2860,1,Book,PROBABILITY AND STATISTICS FOR TECHNOLOGISTS: 0632
Learning Information Theory through Illustrations (KS Information Science Series) [Tomohiko Uematsu],2640,1,Books,LEARNING INFORMATION THEORY THROUGH ILLUSTRATI0633
Maruman Shark Cartilage Granules 90 pieces,2025,1,Health Supplement,MARUMAN SHARK CARTILAGE GRANULES 90 PIECES0634
"Unlabel Lab PL Essence Placenta 50mL, High-Pressure Infusion Concentrated Beauty Serum",1540,5,Other,"UNLABEL LAB PL ESSENCE PLACENTA 50ML, HIGH-PRE0635"
Micro Current Facial Lifter & Rejuvenator MARASIL Kaxa-Lift S 6005,5880,4,Beauty Device,MICRO CURRENT FACIAL LIFTER & REJUVENATOR MARA0636
MELANO CC Medicated Blemish Concentrated Beauty Essence 20ml by ROHTO,1165,4,Beauty/Skincare,MELANO CC MEDICATED BLEMISH CONCENTRATED BEAUT0637
L'Orbel Cool Orange Scalp Conditioner 240g x 3 Set,4244,2,Hair Care,L'ORBEL COOL ORANGE SCALP CONDITIONER 240G X 30638
Rohto Pharmaceutical Deoco Medicated Deodorant Stick 13g,726,5,Health and Beauty,ROHTO PHARMACEUTICAL DEOCO MEDICATED DEODORANT0639
Rohto Pharmaceutical Deoco Medicinal Deodorant Roll-On 30ml,726,5,Health and Beauty,ROHTO PHARMACEUTICAL DEOCO MEDICINAL DEODORANT0640
Natto Kinase Supplement with Monaco Lyne and Garlic Extract,4439,3,Health Supplement,NATTO KINASE SUPPLEMENT WITH MONACO LYNE AND G0641
"Touchi Bean Extract 240 Tablets, Set of 6, Free Shipping",6180,3,Other,"TOUCHI BEAN EXTRACT 240 TABLETS, SET OF 6, FRE0642"
Ikemoto Seduce Hair Brush Blue,620,4,Hair Care,IKEMOTO SEDUCE HAIR BRUSH BLUE0643
Ikemoto Aging Care Scalp Brush TC1300,1050,5,Health & Beauty,IKEMOTO AGING CARE SCALP BRUSH TC13000644
Ikemoto Du-Boa Damage Care Brush Pink,580,2,Hair Care Brush,IKEMOTO DU-BOA DAMAGE CARE BRUSH PINK0645
Mineral Ion Poly Hair Brush Pink by Bes Industrial Mineral Ion Brush PK,328,5,Hair Care,MINERAL ION POLY HAIR BRUSH PINK BY BES INDUST0646
Ikemoto Seduce A.P Brushing Brush Red,620,4,Hair Care Brush,IKEMOTO SEDUCE A.P BRUSHING BRUSH RED0647
Pabron Gold A Tablets 210 [Cold Medicine],1375,2,Pharmaceuticals,PABRON GOLD A TABLETS 210 [COLD MEDICINE]0648
Pabron Gold A Fine Granules 44 Packs [Cold Medicine],1375,2,Healthcare & Pharmacy,PABRON GOLD A FINE GRANULES 44 PACKS [COLD MED0649
Kimmidoll Stylish Hair Brush MAKI (Soft Bristle Detangling Comb for Sensitive Scalp),1100,1,Hair Care,KIMMIDOLL STYLISH HAIR BRUSH MAKI (SOFT BRISTL0650
Kimmidoll Kyoka Cute Hair Brush,1100,1,Hair Care,KIMMIDOLL KYOKA CUTE HAIR BRUSH0651
Kimmidoll Haruko Hair Brush Cute Designrear Comb Soft Bristle Gentle on Scalp Hair Care for Bedtime or After Bath Mother's Day Gift,1100,1,Hair Care,KIMMIDOLL HARUKO HAIR BRUSH CUTE DESIGNREAR CO0652
Kimmidoll SAYAKA Soft Hair Brush,1100,1,Hair Care,KIMMIDOLL SAYAKA SOFT HAIR BRUSH0653
Kimmidoll Tomomi Cute Hair Brush,1100,1,Hair Care,KIMMIDOLL TOMOMI CUTE HAIR BRUSH0654
"Dasmock B 80 Tablets x 5 Set, Seihaito Lung Cleansing Medicine",10695,1,Other,"DASMOCK B 80 TABLETS X 5 SET, SEIHAITO LUNG CL0655"
Usekin I (Eye Care) Set,3422,1,Health Supplement,USEKIN I (EYE CARE) SET0656
"ES O2 Bubble Pack (Oxygen Bubble Pack) 150g / ReCell (Anti-Dullness, Wrinkle, Sagging, Face, Neck, Decollete Pack)",7480,1,Other,ES O2 BUBBLE PACK (OXYGEN BUBBLE PACK) 150G / 0657
"Neck Massager Belulu Relaxbe, Heated EMS Straight Neck Esthetic Device for Smartphone Neck Relief, Free Shipping and 1 Year Warranty",11980,2,Other,"NECK MASSAGER BELULU RELAXBE, HEATED EMS STRAI0658"
Ultra Sonic Water Peeling Belulu AquaRufa Facial Steamer Cleansing Ionizer Blackhead Acne Remover Moisturizer Lifting Anti-Aging Pore Care,3000,3,Beauty_and_Skincare,ULTRA SONIC WATER PEELING BELULU AQUARUFA FACI0659
L'Orbel Cool Orange Scalp Conditioner 240g x 3 Set,4244,1,Hair Care,L'ORBEL COOL ORANGE SCALP CONDITIONER 240G X 30660
Max Hyaluronic Acid 8 Piece Set Beauty Supplement with Hyaluronic Acid and Collagen,9288,1,Health Supplement,MAX HYALURONIC ACID 8 PIECE SET BEAUTY SUPPLEM0661
"Spirulina Ginkgo Leaf Supplement 1200 Tablets, Approximately 30 Days Supply, Superfood, Whole Food, for Vegetable Deficiency and Forgetfulness, by Swiss Linea Health Food Company",2116,5,Other,"SPIRULINA GINKGO LEAF SUPPLEMENT 1200 TABLETS,0662"
Spirulina 10 Grain Spoon,220,5,Supplements,SPIRULINA 10 GRAIN SPOON0663
Shiseido Aqua Label Special Gel Cream N (Moist) 90g,1584,2,Skincare,SHISEIDO AQUA LABEL SPECIAL GEL CREAM N (MOIST0664
Shiseido Aqua Label Special Gel Cream A (White) 90g Non-Prescription Drug,1584,5,Skincare,SHISEIDO AQUA LABEL SPECIAL GEL CREAM A (WHITE0665
Rohto Pharmaceutical Deoco Medicinal Deodorant Roll-On 30ml,726,1,Health and Beauty,ROHTO PHARMACEUTICAL DEOCO MEDICINAL DEODORANT0666
"Natto Kinase with Monacolin and Quercetin Extract, 8 tablets per day, 240 tablets, Supplement",4439,4,Other,NATTO KINASE WITH MONACOLIN AND QUERCETIN EXTR0667
Micro Current Facial Device Kaxa-Lift S MARASIL,5880,1,Beauty Device,MICRO CURRENT FACIAL DEVICE KAXA-LIFT S MARASI0668
Micro Current Facial Device Kaxa-Lift S MARASIL,5880,1,Beauty Device,MICRO CURRENT FACIAL DEVICE KAXA-LIFT S MARASI0669
Father's Day Gift Neck Massager Belulu Relaxbe Warm EMS Smartphone Neck Relief with Free Shipping and 1 Year Warranty,11980,1,Health and Beauty,FATHER'S DAY GIFT NECK MASSAGER BELULU RELAXBE0670
Ikemoto Aging Care Scalp Brush TC1300,1050,6,Health & Beauty,IKEMOTO AGING CARE SCALP BRUSH TC13000671
Inventory Clearance Sale: Large Lightweight TSA Lock Suitcase with 8 Wheels and Expandable Design,4480,1,Luggage,INVENTORY CLEARANCE SALE: LARGE LIGHTWEIGHT TS0672
Shiseido Elixir Superieur Day Care Revolution T+ (SPF50+ PA++++) 35ml,2536,1,Skincare,SHISEIDO ELIXIR SUPERIEUR DAY CARE REVOLUTION 0673
Shiseido Elixir Superieur Lift Night Cream W 40g Cream,4580,1,Beauty_and_Skincare,SHISEIDO ELIXIR SUPERIEUR LIFT NIGHT CREAM W 40674
Shiseido Elixir Superieur Tsyaya Tama Mist 80ml [Beauty Lotion Mist],1590,1,Beauty & Personal Care,SHISEIDO ELIXIR SUPERIEUR TSYAYA TAMA MIST 80M0675
Shiseido Benefique UV-AA Deep Block Essence 50ml (Sunscreen Lotion for Face & Body),3080,1,Beauty & Personal Care,SHISEIDO BENEFIQUE UV-AA DEEP BLOCK ESSENCE 500676
Shiseido Adenovital Shampoo 250ml,1539,4,Hair Care,SHISEIDO ADENOVITAL SHAMPOO 250ML0677
"Black, Platinum, Gold, Matcha Gel Pack 90g Raw Material Black, Platinum, Gold, Matcha Green Tea Gel Pack Pore Pack",700,2,Other,"BLACK, PLATINUM, GOLD, MATCHA GEL PACK 90G RAW0678"
"Neck Massager Belulu Relaxbe, Heated EMS Straight Neck Esthetic Device for Smartphone Neck Relief, Free Shipping and 1 Year Warranty",11980,1,Other,"NECK MASSAGER BELULU RELAXBE, HEATED EMS STRAI0679"
Micro Current Facial Lifter & Rejuvenator MARASIL Kaxa-Lift S 6005,5880,1,Beauty Device,MICRO CURRENT FACIAL LIFTER & REJUVENATOR MARA0680
Shiseido TSUBAKI Smooth Straight Shampoo Refill 330mL,374,6,Hair Care,SHISEIDO TSUBAKI SMOOTH STRAIGHT SHAMPOO REFIL0681
Shiseido Tsubaki Fluffy Shine Shampoo Refill 330mL,374,6,Hair Care,SHISEIDO TSUBAKI FLUFFY SHINE SHAMPOO REFILL 30682
Belulu Aquarufa KRD-1027D/WT Ultrasonic Facial Cleanser,3799,1,Beauty & Personal Care,BELULU AQUARUFA KRD-1027D/WT ULTRASONIC FACIAL0683
Belulu Aquarufa KRD-1027D/PK Ultrasonic Facial Cleanser,3799,1,Beauty & Personal Care,BELULU AQUARUFA KRD-1027D/PK ULTRASONIC FACIAL0684
Rohto Pharmaceutical Deoco Body Cleansing Soap 75g,564,5,Health and Beauty,ROHTO PHARMACEUTICAL DEOCO BODY CLEANSING SOAP0685
Rohto Pharmaceutical Deoco Medicinal Deodorant Roll-On 30ml,719,1,Health and Beauty,ROHTO PHARMACEUTICAL DEOCO MEDICINAL DEODORANT0686
Rohto Pharmaceutical SKIN AQUA Sarafit UV Milky Serum 40ml,700,6,Beauty_and_Personal_Care,ROHTO PHARMACEUTICAL SKIN AQUA SARAFIT UV MILK0687
"Intime White Cream | Delicate Area Dark Spot Cream for Armpits, Nipples, Bikini Line, Organic, Made in Japan with Natural Herbal Ingredients",2860,2,Other,INTIME WHITE CREAM | DELICATE AREA DARK SPOT C0688
"Neck Massager Belulu Relaxbe, Heated EMS Straight Neck Esthetic for Smartphone Neck, 1-Year Warranty, Gift for Shoulder Pain & Headache Relief",11980,1,Other,"NECK MASSAGER BELULU RELAXBE, HEATED EMS STRAI0689"
Minimum Purchase 9900 Yen Shiseido Benefique UV-AA Deep Block Essence 50ml (Sunscreen Beauty Lotion for Face and Body),3080,4,Beauty kariyelperlardan,MINIMUM PURCHASE 9900 YEN SHISEIDO BENEFIQUE U0690
"Natto Kinase with Monacolin and Quercetin Extract, 8 tablets per day, 240 tablets, Supplement",4439,2,Other,NATTO KINASE WITH MONACOLIN AND QUERCETIN EXTR0691
Fino Premium Touch Penetrating Beauty Liquid Hair Mask,757,1,Hair Care,FINO PREMIUM TOUCH PENETRATING BEAUTY LIQUID H0692
Ultra Lightweight Large Suitcase with TSA Lock and 8 Wheels,4980,1,Luggage,ULTRA LIGHTWEIGHT LARGE SUITCASE WITH TSA LOCK0693
Slim Up Slim Veggie Full Red Smoothie Berry Yogurt Flavor 300g,1470,1,Health Supplement,SLIM UP SLIM VEGGIE FULL RED SMOOTHIE BERRY YO0694
Shiseido TSUBAKI Airy Smooth Refill Shampoo,374,1,Hair Care,SHISEIDO TSUBAKI AIRY SMOOTH REFILL SHAMPOO0695
Shiseido Professional The Hair Care Adenovital Scalp Treatment 130g × 2,2138,1,Hair Care,SHISEIDO PROFESSIONAL THE HAIR CARE ADENOVITAL0696
Kose Clear Turn Lift Glow Lotion III Rich Refill 150ml,2195,1,Beauty_Care,KOSE CLEAR TURN LIFT GLOW LOTION III RICH REFI0697
Maruman Shark Cartilage Granules 90 pieces,2025,1,Health Supplement,MARUMAN SHARK CARTILAGE GRANULES 90 PIECES0698
"Rakuten Award Winning MU-MIMO WiFi Router Archer A10, Dual Band Gigabit Wireless Router with 2533Mbps Speed (1733Mbps+800Mbps) and IPv6 Support",7500,1,Other,RAKUTEN AWARD WINNING MU-MIMO WIFI ROUTER ARCH0699
HR100BL Hyaluronic Acid Infusion Damage Care Styling Brush,873,9,Hair Care,HR100BL HYALURONIC ACID INFUSION DAMAGE CARE S0700
"Spirulina 100% 2400 Tablets, Buy 6 Get 1 Free Supplement BCAA for Veggie Deficiency, Poor Eating Habits, Diet Aid, Superfood Health Food",12696,2,Other,"SPIRULINA 100% 2400 TABLETS, BUY 6 GET 1 FREE 0701"
Belulu Aquarufa KRD-1027D/PK Ultrasonic Facial Cleanser,3799,3,Beauty & Personal Care,BELULU AQUARUFA KRD-1027D/PK ULTRASONIC FACIAL0702
Belulu Aquarufa KRD-1027D/WT Ultrasonic Facial Cleanser,3799,3,Beauty & Personal Care,BELULU AQUARUFA KRD-1027D/WT ULTRASONIC FACIAL0703
Shiseido Elixir Superieur Sleeping Gel Pack W 105g,2536,4,Skincare,SHISEIDO ELIXIR SUPERIEUR SLEEPING GEL PACK W 0704
Yamamoto Kampo Toku-yo Barley Young Leaf Powder 100% 3g x 44 packets,975,1,Supplement,YAMAMOTO KAMPO TOKU-YO BARLEY YOUNG LEAF POWDE0705
Hokushin Kakomon Mathematics 3rd Year Junior High 2020 Edition Past Test Questions Collection,700,1,Book,HOKUSHIN KAKOMON MATHEMATICS 3RD YEAR JUNIOR H0706
All Clear Oil Face Wash Specialist Makeup Remover Oil 230mL,920,1,Beauty/Skincare,ALL CLEAR OIL FACE WASH SPECIALIST MAKEUP REMO0707
Rohto Pharmaceutical Deoco Medicinal Deodorant Roll-On 30ml,719,1,Health and Beauty,ROHTO PHARMACEUTICAL DEOCO MEDICINAL DEODORANT0708
Shiseido Professional Adenovital Eye Lash Serum 6g,1383,6,Beauty/Cosmetics,SHISEIDO PROFESSIONAL ADENOVITAL EYE LASH SERU0709
"Collagen 20000 Plus 50ml x 10, 2 Boxes (20 Pieces Set) Exbnte Free Shipping",6860,1,Other,"COLLAGEN 20000 PLUS 50ML X 10, 2 BOXES (20 PIE0710"
Lebel Pro Edit Careworks Element Fix PPT NMF CMC Hair Care Treatment Nozzle,101,1,Hair Care,LEBEL PRO EDIT CAREWORKS ELEMENT FIX PPT NMF C0711
Lebel Pro Edit Careworks Element Fix PPT NMF CMC Trigger,198,3,Hair Care,LEBEL PRO EDIT CAREWORKS ELEMENT FIX PPT NMF C0712
Lebel Pro Edit Careworks PPT NMF CMC Element Fix Set (150ml each) Hair Care Treatment Salon Exclusive Product,4730,1,Hair Care,LEBEL PRO EDIT CAREWORKS PPT NMF CMC ELEMENT F0713
"Lebel IAU Cell Care Selectable Set of 5 (500ml, 150ml, 500ml, 500ml, 40ml)",9680,1,Other,LEBEL IAU CELL CARE SELECTABLE SET OF 5 (500ML0714
Lubel Pro Edit Care Works Shampoo Soft Fit & Treatment Soft Fit Set (300ml & 250ml),2287,1,Hair Care,LUBEL PRO EDIT CARE WORKS SHAMPOO SOFT FIT & T0715
Lebel Pro Edit Careworks Through Fit Shampoo,1155,1,Hair Care,LEBEL PRO EDIT CAREWORKS THROUGH FIT SHAMPOO0716
Lebel Pro Edit Careworks Through Fit Hair Treatment (250ml),1155,1,Hair Care Treatment,LEBEL PRO EDIT CAREWORKS THROUGH FIT HAIR TREA0717
"Dasmock B 80 Tablets x 5 Set, Seihaito, 2% Off Coupon, Free Shipping",10695,1,Other,"DASMOCK B 80 TABLETS X 5 SET, SEIHAITO, 2% OFF0718"
Uji Matcha Collagen 14 Packs,1080,5,Health Supplement,UJI MATCHA COLLAGEN 14 PACKS0719
Silicone Cupping Set of 4 for Relaxing Lymphatic Massage and Beauty,980,1,Health & Beauty,SILICONE CUPPING SET OF 4 FOR RELAXING LYMPHAT0720
Ipokea EX 18ml x 3 Set Keratin Care Beauty Liquid for Rough Skin & Mole Removal,4703,2,Beauty/Skincare,IPOKEA EX 18ML X 3 SET KERATIN CARE BEAUTY LIQ0721
Ikemoto Aging Care Scalp Brush TC1300,1050,1,Health & Beauty,IKEMOTO AGING CARE SCALP BRUSH TC13000722
Akane Placenta White Pharmaceutical Whitening Eye Cream 30g,785,5,Cosmetics,AKANE PLACENTA WHITE PHARMACEUTICAL WHITENING 0723
Hadasui Eye Mask Concentrated Wrinkle Care 60 sheets Hadabisei Kracie,822,5,Beauty_and_Skincare,HADASUI EYE MASK CONCENTRATED WRINKLE CARE 60 0724
Clear Turn Plump Skin Eye Zone Mask 32 Uses (64 Sheets),726,5,Beauty Care,CLEAR TURN PLUMP SKIN EYE ZONE MASK 32 USES (60725
CoenRich Precious Medicated Whitening Hand Care Cream 60g KOSE COSMEPORT,592,5,Beauty_and_Personal_Care,COENRICH PRECIOUS MEDICATED WHITENING HAND CAR0726
Belulu Rebirth Facial Toner EMS Lift Up Device with Beauty Gel,17800,1,Beauty Device,BELULU REBIRTH FACIAL TONER EMS LIFT UP DEVICE0727
"Okinawa Fucoidan Capsule Set (2 Pieces, 180 Tablets)",14198,1,Other,"OKINAWA FUCOIDAN CAPSULE SET (2 PIECES, 180 TA0728"
Fragrant Supplement Set of 3 for Portable Oral Etiquette,1000,2,Health_Supplement,FRAGRANT SUPPLEMENT SET OF 3 FOR PORTABLE ORAL0729
Collagen Tripeptide Spirulina Marine Collagen Low MolecularWeight Collagen Supplement Skin Care Fasting Diet Whole Food Protein Rich Health Food,2116,5,Health Supplement,COLLAGEN TRIPEPTIDE SPIRULINA MARINE COLLAGEN 0730
Shiseido TSUBAKI Airy Smooth Refill Shampoo,374,5,Hair Care,SHISEIDO TSUBAKI AIRY SMOOTH REFILL SHAMPOO0731
