product_name,price,stock,category_name,sku
Shiseido TSUBAKI Volume Touch Shampoo Refill 345mL,462,5,Hair Care,SHISEIDO TSUBAKI VOLUME TOUCH SHAMPOO REFILL 30732
Shiseido Elixir Superieur Sleeping Gel Pack W 105g (Gel Pack),2536,2,Skincare,SHISEIDO ELIXIR SUPERIEUR SLEEPING GEL PACK W 0733
Shiseido Benefique UV AA Deep Block Essence 50ml (Sunscreen Lotion for Face & Body),3080,2,Beauty & Personal Care,SHISEIDO BENEFIQUE UV AA DEEP BLOCK ESSENCE 500734
Ultra Sonic Water Peeling Belulu AquaRufa Facial Steamer Cleansing Ionizer Blackhead Acne Remover Moisturizer Lifting Anti-Aging Pore Care,3000,2,Beauty_and_Skincare,ULTRA SONIC WATER PEELING BELULU AQUARUFA FACI0735
Ultra Sonic Water Peeling Belulu AquaRufa Facial Steamer Cleansing Ionizer Blackhead Acne Remover Moisturizer Lifting Anti-Aging Pore Care,3000,1,Beauty_and_Skincare,ULTRA SONIC WATER PEELING BELULU AQUARUFA FACI0736
Shiseido Adenovital Eyelash Serum,1357,1,Beauty/Cosmetics,SHISEIDO ADENOVITAL EYELASH SERUM0737
Slim Up Slim Veggie Full Red Smoothie Berry Yogurt Flavor 300g,1470,1,Health Supplement,SLIM UP SLIM VEGGIE FULL RED SMOOTHIE BERRY YO0738
Shiseido Selena Noir N Women's Hair Growth Essence 150ml,3300,5,Hair Care,SHISEIDO SELENA NOIR N WOMEN'S HAIR GROWTH ESS0739
"Collagen 20000 Plus 50ml x 10, 2 Boxes (20 Pieces Set) Exbnte Free Shipping",6860,1,Other,"COLLAGEN 20000 PLUS 50ML X 10, 2 BOXES (20 PIE0740"
Shiseido Aqua Label Special Gel Cream N (Moist) 90g,1584,1,Skincare,SHISEIDO AQUA LABEL SPECIAL GEL CREAM N (MOIST0741
Shiseido Aqua Label Special Gel Cream A (White) 90g Non-Prescription Drug,1584,1,Skincare,SHISEIDO AQUA LABEL SPECIAL GEL CREAM A (WHITE0742
Micro Current Facial Device Kaxa-Lift S MARASIL,5880,3,Beauty Device,MICRO CURRENT FACIAL DEVICE KAXA-LIFT S MARASI0743
Facial Machine Belulu Classy LED Cleansing Ion Infusion Device,11980,1,Beauty Device,FACIAL MACHINE BELULU CLASSY LED CLEANSING ION0744
"Neck Massager Belulu Relaxbe, Heated EMS Straight Neck Esthetic for Smartphone Neck, 1-Year Warranty, Gift for Shoulder Pain & Headache Relief",11980,3,Other,"NECK MASSAGER BELULU RELAXBE, HEATED EMS STRAI0745"
"Touchi Bean Extract 240 Tablets, Set of 6, Free Shipping",5560,2,Other,"TOUCHI BEAN EXTRACT 240 TABLETS, SET OF 6, FRE0746"
Max Hyaluronic Acid 8 Piece Set Beauty Supplement with Hyaluronic Acid and Collagen,9288,1,Health Supplement,MAX HYALURONIC ACID 8 PIECE SET BEAUTY SUPPLEM0747
"Spirulina 100% 2400 Tablets, Buy 6 Get 1 Free Supplement BCAA for Veggie Deficiency, Poor Eating Habits, Diet Aid, Superfood Health Food",12696,1,Other,"SPIRULINA 100% 2400 TABLETS, BUY 6 GET 1 FREE 0748"
Ipokea EX 18ml x 3 Set Keratin Care Beauty Liquid for Rough Skin & Mole Removal,4703,2,Beauty/Skincare,IPOKEA EX 18ML X 3 SET KERATIN CARE BEAUTY LIQ0749
Shiseido Certified Online Shop Shiseido d Program Allerbaria Essence BB N Medium,2360,3,Cosmetics,SHISEIDO CERTIFIED ONLINE SHOP SHISEIDO D PROG0750
Skin Aqua Sarafit UV SPF50+ PA++++ Spray 50g x 3 Fragrance-Free UV Cut Sunscreen for Face Makeup Hair,2180,4,Beauty & Personal Care,SKIN AQUA SARAFIT UV SPF50+ PA++++ SPRAY 50G X0751
Shiseido Adenovital Shampoo 250ml,1539,1,Hair Care,SHISEIDO ADENOVITAL SHAMPOO 250ML0752
Shiseido Adenovital Eyelash Serum,1382,1,Beauty/Cosmetics,SHISEIDO ADENOVITAL EYELASH SERUM0753
Lebel Pro Edit Hairskin Float Cleansing 250ml with Exclusive Nozzle,91,1,Hair Care,LEBEL PRO EDIT HAIRSKIN FLOAT CLEANSING 250ML 0754
Shiseido Maquillage Dramatic Skin Sensor Base EX 25ml [Makeup Base],2100,2,Cosmetics,SHISEIDO MAQUILLAGE DRAMATIC SKIN SENSOR BASE 0755
Shiseido Benefique UV AA Deep Block Essence 50ml (Sunscreen Lotion for Face & Body),3080,2,Beauty & Personal Care,SHISEIDO BENEFIQUE UV AA DEEP BLOCK ESSENCE 500756
Touchi Bean Extract Pills 240 Tablets 6 Sets Free Shipping,6180,2,Health Supplements,TOUCHI BEAN EXTRACT PILLS 240 TABLETS 6 SETS F0757
"Lactis Probiotic Supplement No.1 in Medical Institutions for 10 Consecutive Years, 30 Packs of 10ml",7800,4,Other,LACTIS PROBIOTIC SUPPLEMENT NO.1 IN MEDICAL IN0758
Maruman Shark Cartilage Granules 90 pieces,2025,1,Health Supplement,MARUMAN SHARK CARTILAGE GRANULES 90 PIECES0759
Shiseido Radiant Lifting Foundation SPF 15 - #I20 Natural Light Ivory 30ml/1.2oz,4800,1,Cosmetics,SHISEIDO RADIANT LIFTING FOUNDATION SPF 15 - #0760
"Dasmonck B 80 Tablets x 5 Set, Seihaito, 2% Off Coupon, Free Shipping",10695,1,Other,"DASMONCK B 80 TABLETS X 5 SET, SEIHAITO, 2% OF0761"
"Spirulina Ginkgo Leaf Supplement 1200 Tablets, Approximately 30 Days Supply, Superfood, Whole Food, for Vegetable Deficiency and Forgetfulness, by Swiss Linea Health Food Company",2116,5,Other,"SPIRULINA GINKGO LEAF SUPPLEMENT 1200 TABLETS,0762"
Ogi Pharmaceutical Papain Z 5 120 tablets,1518,5,Health_Supplement,OGI PHARMACEUTICAL PAPAIN Z 5 120 TABLETS0763
Shiseido Professional Adenovital Eye Lash Serum 6g,1383,6,Beauty/Cosmetics,SHISEIDO PROFESSIONAL ADENOVITAL EYE LASH SERU0764
Slim Up Slim Veggie Full Red Smoothie Berry Yogurt Flavor 300g,1470,2,Health Supplement,SLIM UP SLIM VEGGIE FULL RED SMOOTHIE BERRY YO0765
"Neck Massager Belulu Relaxbe, Heated EMS Straight Neck Esthetic for Smartphone Neck, 1-Year Warranty, Gift for Shoulder Pain & Headache Relief",11980,1,Other,"NECK MASSAGER BELULU RELAXBE, HEATED EMS STRAI0766"
Skin Aqua Tone Up UV Essence Happiness Aura,814,2,Beauty/Skincare,SKIN AQUA TONE UP UV ESSENCE HAPPINESS AURA0767
Ikemoto Seduce Hair Brush Blue,620,1,Hair Care,IKEMOTO SEDUCE HAIR BRUSH BLUE0768
Ikemoto Aging Care Scalp Brush TC1300,1050,1,Health & Beauty,IKEMOTO AGING CARE SCALP BRUSH TC13000769
Shiseido Selena Noir N Women's Hair Growth Essence 150ml,3300,5,Hair Care,SHISEIDO SELENA NOIR N WOMEN'S HAIR GROWTH ESS0770
Shiseido Authorized Dealer Elixir Superieur Lift Moist Emulsion T II,2937,1,Skincare,SHISEIDO AUTHORIZED DEALER ELIXIR SUPERIEUR LI0771
Shiseido Elixir Superieur Lift Moist Lotion T II,2472,1,Skincare,SHISEIDO ELIXIR SUPERIEUR LIFT MOIST LOTION T 0772
Shiseido Official Store Elixir Superieur Day Care Revolution T Plus Post Parcel Size Extra Home Delivery,2319,1,Beauty_and_Personal_Care,SHISEIDO OFFICIAL STORE ELIXIR SUPERIEUR DAY C0773
Shiseido Elixir Superieur Lift Night Cream W 40g,4539,1,Skin Care,SHISEIDO ELIXIR SUPERIEUR LIFT NIGHT CREAM W 40774
Shiseido Adenovital Shampoo 250ml,1539,1,Hair Care,SHISEIDO ADENOVITAL SHAMPOO 250ML0775
Neck Massager Belulu Relaxbe Thermal EMS Straight Neck Relief for Smartphone Neck Pain with 1 Year Warranty,11980,1,Health & Beauty,NECK MASSAGER BELULU RELAXBE THERMAL EMS STRAI0776
Neck Massager Belulu Relaxbe Thermal EMS Straight Neck Relief for Smartphone Neck Pain with 1 Year Warranty,11980,1,Health & Beauty,NECK MASSAGER BELULU RELAXBE THERMAL EMS STRAI0777
Omron Upper Arm Blood Pressure Monitor HEM-7123,5071,1,Healthcare/Medical Device,OMRON UPPER ARM BLOOD PRESSURE MONITOR HEM-7120778
"10% OFF Facial Lifter, Free Shipping, 500,000 Units Sold, Microcurrent, High Frequency, Ultrasonic, Kassa Lift, MARASIL Kassa Lift S, Anti Wrinkle, Pore Minimizer, Skin Tightening",5292,2,Other,"10% OFF FACIAL LIFTER, FREE SHIPPING, 500,000 0779"
"10% OFF Facial Lifter, Free Shipping, 500,000 Units Sold, Microcurrent, High Frequency, Ultrasonic, Kassa Lift, MARASIL Kassa Lift S, Anti Wrinkle, Pore Minimizer, Skin Tightening",5292,1,Other,"10% OFF FACIAL LIFTER, FREE SHIPPING, 500,000 0780"
Lebel Pro Edit Careworks Hair Treatment Soft Fit Plus,1210,1,Hair Care,LEBEL PRO EDIT CAREWORKS HAIR TREATMENT SOFT F0781
Lebel Pro Edit Careworks Soft Fit Shampoo,1155,1,Hair Care,LEBEL PRO EDIT CAREWORKS SOFT FIT SHAMPOO0782
Lebel Pro Edit Careworks Hair Treatment Bounce Fit Plus,1253,1,Hair Care,LEBEL PRO EDIT CAREWORKS HAIR TREATMENT BOUNCE0783
Lebel Pro Edit Careworks Bounce Fit Shampoo,1232,1,Hair Care,LEBEL PRO EDIT CAREWORKS BOUNCE FIT SHAMPOO0784
Lebel Pro Edit Careworks CMC Refill Hair Treatment 500ml,3102,1,Hair Care,LEBEL PRO EDIT CAREWORKS CMC REFILL HAIR TREAT0785
Lebel Pro Edit Careworks PPT Refill 500ml Hair Care Treatment,3102,1,Hair Care,LEBEL PRO EDIT CAREWORKS PPT REFILL 500ML HAIR0786
HR100BL Hyaluronic Acid Infusion Damage Care Styling Brush,873,1,Hair Care,HR100BL HYALURONIC ACID INFUSION DAMAGE CARE S0787
Coconut Oil Styling Brush CC-1060,895,5,Hair Care,COCONUT OIL STYLING BRUSH CC-10600788
Shiseido Eyebrow Pencil Grey 4,174,2,Cosmetics,SHISEIDO EYEBROW PENCIL GREY 40789
Shiseido Eyebrow Pencil Black,174,2,Cosmetics,SHISEIDO EYEBROW PENCIL BLACK0790
Shiseido Fino Premium Touch Deep Nourishing Hair Mask Fino Treatment Hair Pack,777,5,Hair Care,SHISEIDO FINO PREMIUM TOUCH DEEP NOURISHING HA0791
"Sarasalia Garcinia Banaba Chrome Touche Supplement, approximately 240 tablets",1030,1,Other,SARASALIA GARCINIA BANABA CHROME TOUCHE SUPPLE0792
Neck Massager Belulu Relaxbe Thermal EMS Straight Neck Relief for Smartphone Neck Pain Gift with Free Shipping and 1 Year Warranty,11980,1,Health & Beauty,NECK MASSAGER BELULU RELAXBE THERMAL EMS STRAI0793
Shiseido Adenovital Shampoo 250ml,1548,5,Hair Care,SHISEIDO ADENOVITAL SHAMPOO 250ML0794
Mama & Kids Natural Mark Cream 470g Eternal Release Design Bottle Body Cream for Stretch Marks & Pregnancy Lines,7996,1,Beauty_and_Cosmetics,MAMA & KIDS NATURAL MARK CREAM 470G ETERNAL RE0795
Maruman Shark Cartilage Granules 90 pieces,2025,1,Health Supplement,MARUMAN SHARK CARTILAGE GRANULES 90 PIECES0796
"Natto Kinase with Monacolin and Quercetin Extract, 8 tablets per day, 240 tablets, Supplement",4440,2,Other,NATTO KINASE WITH MONACOLIN AND QUERCETIN EXTR0797
Blendy Cafe Latte Stick Coffee Rich Caramel Macchiato,1027,1,Food/Beverage,BLENDY CAFE LATTE STICK COFFEE RICH CARAMEL MA0798
Blendy Cafe Latte Stick Coffee Rich Creamy Cappuccino,514,1,Beverages,BLENDY CAFE LATTE STICK COFFEE RICH CREAMY CAP0799
AGF Blendy Cafe Latte Stick Rich Matcha Latte,797,1,Beverages,AGF BLENDY CAFE LATTE STICK RICH MATCHA LATTE0800
Sofy Kiyora Sakura Happiness 14cm Panty Liner Refills (72 sheets x 5 pack set),1644,1,Sanitary Products,SOFY KIYORA SAKURA HAPPINESS 14CM PANTY LINER 0801
Free Shipping! Premium Amino Collagen Refill 214g x20 Set,49200,1,Supplements,FREE SHIPPING! PREMIUM AMINO COLLAGEN REFILL 20802
Ikemoto Aging Care Scalp Brush TC1300,1050,1,Health & Beauty,IKEMOTO AGING CARE SCALP BRUSH TC13000803
Hairy Hairy Adult Beautiful Neck Cream 40g,1178,5,Beauty_and_Personal_Care,HAIRY HAIRY ADULT BEAUTIFUL NECK CREAM 40G0804
"Free Shipping Smart Letter Face Lift Sheet, 3 Sets of 10 Sheets, Relieves Shoulder and Lower Back Pain",3000,3,Other,"FREE SHIPPING SMART LETTER FACE LIFT SHEET, 3 0805"
Slim Up Slim Veggie Full Red Smoothie Berry Yogurt Flavor 300g,1470,1,Health Supplement,SLIM UP SLIM VEGGIE FULL RED SMOOTHIE BERRY YO0806
Micro Current Facial Device Kaxa-Lift S MARASIL,5880,1,Beauty Device,MICRO CURRENT FACIAL DEVICE KAXA-LIFT S MARASI0807
Ikimoto Brush Seduce Brushing Brush Red SEN-705,620,1,Hair Care Brush,IKIMOTO BRUSH SEDUCE BRUSHING BRUSH RED SEN-700808
"Spirulina 100% 2400 Tablets, Buy 6 Get 1 Free Supplement BCAA for Veggie Deficiency, Poor Eating Habits, Diet Aid, Superfood Health Food",12696,2,Other,"SPIRULINA 100% 2400 TABLETS, BUY 6 GET 1 FREE 0809"
"DHC Ladies' Care Essence 30-Day Supply, 8 Plant Extracts to Support Rhythmic Balance for Women in 40s & 50s",1360,5,Other,"DHC LADIES' CARE ESSENCE 30-DAY SUPPLY, 8 PLAN0810"
Shiseido Professional Adenovital Eye Lash Serum 6g,1383,6,Beauty/Cosmetics,SHISEIDO PROFESSIONAL ADENOVITAL EYE LASH SERU0811
Orihiro Nattokinase 4000 60 Tablets × 3 Set,5800,1,Health Supplement,ORIHIRO NATTOKINASE 4000 60 TABLETS × 3 SET0812
Shiseido Adenovital Shampoo 250ml [The Hair Care Medicinal Scalp Care],1548,4,Hair Care,SHISEIDO ADENOVITAL SHAMPOO 250ML [THE HAIR CA0813
Fumakiller Allergy Shot Nasal Spray Mist Type 70ml,548,1,Healthcare,FUMAKILLER ALLERGY SHOT NASAL SPRAY MIST TYPE 0814
Elixir Superiel Daycare Revolution T+ with Up to 450 Yen Off Coupon,2297,3,Skincare,ELIXIR SUPERIEL DAYCARE REVOLUTION T+ WITH UP 0815
Elixir Superiel Lift Night Cream W 40g,4125,3,Skincare,ELIXIR SUPERIEL LIFT NIGHT CREAM W 40G0816
Micro Current Facial Lifter & Rejuvenator MARASIL Kaxa-Lift S 6005,5880,1,Beauty Device,MICRO CURRENT FACIAL LIFTER & REJUVENATOR MARA0817
Slim Up Slim Veggie Full Red Smoothie Berry Yogurt Flavor 300g,1470,1,Health Supplement,SLIM UP SLIM VEGGIE FULL RED SMOOTHIE BERRY YO0818
Maruman Shark Cartilage Granules 90 pieces,2025,1,Health Supplement,MARUMAN SHARK CARTILAGE GRANULES 90 PIECES0819
"Touchi Bean Extract 240 Tablets, Set of 6, Free Shipping",6180,1,Other,"TOUCHI BEAN EXTRACT 240 TABLETS, SET OF 6, FRE0820"
Dentifine Rubber Grip Mountain Cut Standard Single Toothbrush,62,1,Health and Beauty,DENTIFINE RUBBER GRIP MOUNTAIN CUT STANDARD SI0821
Mikasa Ball Bag for 1 Ball,1540,1,Sports Equipment,MIKASA BALL BAG FOR 1 BALL0822
Mikasa Ball Bag for 2 Balls (White),2400,1,Sports Equipment,MIKASA BALL BAG FOR 2 BALLS (WHITE)0823
Free Shipping! Amino Collagen Premium Refill 214g x 4 Set,10190,1,Supplements,FREE SHIPPING! AMINO COLLAGEN PREMIUM REFILL 20824
Shiseido Adenovital Scalp Treatment 130g x 2 Bottles,2150,2,Hair Care,SHISEIDO ADENOVITAL SCALP TREATMENT 130G X 2 B0825
Shiseido Adenovital Shampoo 250ml,1548,5,Hair Care,SHISEIDO ADENOVITAL SHAMPOO 250ML0826
Shiseido The Collagen Powder 126g x 24 pieces (1 case),32400,1,Health Supplement,SHISEIDO THE COLLAGEN POWDER 126G X 24 PIECES 0827
Orihiro Deep Sea Shark Cartilage Capsule Value Pack 360 Tablets,1971,1,Health Supplement,ORIHIRO DEEP SEA SHARK CARTILAGE CAPSULE VALUE0828
"Dasmock B 80 Tablets x 5 Set, Seihaito Lung Cleansing Medicine",10695,1,Other,"DASMOCK B 80 TABLETS X 5 SET, SEIHAITO LUNG CL0829"
Shiseido TSUBAKI Premium Repair Mask 180g,998,5,Beauty/Cosmetics,SHISEIDO TSUBAKI PREMIUM REPAIR MASK 180G0830
Fino Premium Touch Penetrating Beauty Liquid Hair Mask 230g Wash-Off Treatment,752,6,Beauty/Cosmetics,FINO PREMIUM TOUCH PENETRATING BEAUTY LIQUID H0831
All Clear Oil Face Wash Specialist Makeup Remover Oil 230mL,902,4,Beauty/Skincare,ALL CLEAR OIL FACE WASH SPECIALIST MAKEUP REMO0832
Special Perfect Whip u 120g,387,4,Skincare,SPECIAL PERFECT WHIP U 120G0833
"Spirulina 100% 2400 Tablets, Buy 6 Get 1 Free Supplement BCAA for Veggie Deficiency, Poor Eating Habits, Diet Aid, Superfood Health Food",12696,1,Other,"SPIRULINA 100% 2400 TABLETS, BUY 6 GET 1 FREE 0834"
Shiseido Authorized Store Genuine Product Elixir Superieur Lift Night Cream W 40g,4125,2,Skincare,SHISEIDO AUTHORIZED STORE GENUINE PRODUCT ELIX0835
"Shiseido Authorized Store Genuine Product Elixir Superieur Day Care Revolution T Plus, Postal Parcel Size Exceeds Home Delivery",2297,2,Other,SHISEIDO AUTHORIZED STORE GENUINE PRODUCT ELIX0836
"Spirulina 100% 2400 Tablets, Buy 6 Get 1 Free Supplement BCAA for Veggie Deficiency, Poor Eating Habits, Diet Aid, Superfood Health Food",12696,1,Other,"SPIRULINA 100% 2400 TABLETS, BUY 6 GET 1 FREE 0837"
"New Year Sale Facial Toner 500,000 Units Sold, Free Shipping, Same Day Shipping, Kassa Plate, Kassa Facial, Microcurrent, High Frequency, Ultrasonic, Ion Introduction, Anti-Wrinkle, Lift Up, Pores, Spots, Sagging, MARASIL-Kassa Lift (Kaxa-lift s)6005",5880,1,Other,"NEW YEAR SALE FACIAL TONER 500,000 UNITS SOLD,0838"
Ipokea EX 18ml x 3 Set Keratin Care Beauty Liquid for Rough Skin & Mole Removal,4702,1,Beauty/Skincare,IPOKEA EX 18ML X 3 SET KERATIN CARE BEAUTY LIQ0839
Micro Current Facial Device Kaxa-Lift S MARASIL,5880,1,Beauty Device,MICRO CURRENT FACIAL DEVICE KAXA-LIFT S MARASI0840
Shiseido Professional The Hair Care Adenovital Scalp Treatment 130g × 2,2138,5,Hair Care,SHISEIDO PROFESSIONAL THE HAIR CARE ADENOVITAL0841
OMRON Upper Arm Blood Pressure Monitor HEM-7131,4380,2,Healthcare Device,OMRON UPPER ARM BLOOD PRESSURE MONITOR HEM-7130842
Tsujiri Kyoto Latte Matcha & Milk 14g (10 pieces),438,8,Food/Beverage,TSUJIRI KYOTO LATTE MATCHA & MILK 14G (10 PIEC0843
Shiseido Elixir Superieur Sleeping Gel Pack W 105g,2617,4,Skincare,SHISEIDO ELIXIR SUPERIEUR SLEEPING GEL PACK W 0844
AQUALABEL Special Gel Cream A (White) All-in-One 90g,1080,1,Skincare,AQUALABEL SPECIAL GEL CREAM A (WHITE) ALL-IN-O0845
Cleansing Research Peeling Lotion 200mL,977,6,Skincare,CLEANSING RESEARCH PEELING LOTION 200ML0846
"Dasmock B 80 Tablets x 5 Set, Seihaito, 2% Off Coupon, Free Shipping",10695,1,Other,"DASMOCK B 80 TABLETS X 5 SET, SEIHAITO, 2% OFF0847"
Shiseido Elixir Superieur Day Care Revolution T+ (SPF50+ PA++++) 35ml Non-Prescription Quasi-Drug [Morning Moisturizer],2536,1,Beauty/Skincare,SHISEIDO ELIXIR SUPERIEUR DAY CARE REVOLUTION 0848
Shiseido Elixir Superieur Lift Night Cream W 40g,4580,1,Skin Care,SHISEIDO ELIXIR SUPERIEUR LIFT NIGHT CREAM W 40849
Shiseido Benefique UV AA Deep Block Essence 50ml (Sunscreen Lotion for Face & Body),3080,1,Beauty & Personal Care,SHISEIDO BENEFIQUE UV AA DEEP BLOCK ESSENCE 500850
DHC Power Food Spirulina 30-Day Supply x 3 Packs (810 Tablets) Chlorophyll Carotenoid Folic Acid Supplement,4579,1,Health_Supplement,DHC POWER FOOD SPIRULINA 30-DAY SUPPLY X 3 PAC0851
Tsujiri Kyoto Latte Matcha & Milk 14g (10 pieces),438,7,Food/Beverage,TSUJIRI KYOTO LATTE MATCHA & MILK 14G (10 PIEC0852
"Dasmock B 80 Tablets x 5 Set, Seihaito Lung Cleansing Medicine",10695,1,Other,"DASMOCK B 80 TABLETS X 5 SET, SEIHAITO LUNG CL0853"
Touchi Bean Extract Pills 240 Tablets 6 Sets Free Shipping,6180,1,Health Supplements,TOUCHI BEAN EXTRACT PILLS 240 TABLETS 6 SETS F0854
Yugetsu Bijin Yomogi Warmth Patch 6 Pieces,922,5,Health_Supplement,YUGETSU BIJIN YOMOGI WARMTH PATCH 6 PIECES0855
Uji Matcha Collagen,728,6,Supplements,UJI MATCHA COLLAGEN0856
Shiseido Professional The Hair Care Adenovital Shampoo 250ml,1487,6,Hair Care,SHISEIDO PROFESSIONAL THE HAIR CARE ADENOVITAL0857
Shiseido Professional The Hair Care Adenovital Scalp Treatment 130g × 2,2081,3,Hair Care,SHISEIDO PROFESSIONAL THE HAIR CARE ADENOVITAL0858
Shiseido The Collagen High Beauty Active Powder 126g x 24 pieces (1 Case),32500,1,Beauty/Supplement,SHISEIDO THE COLLAGEN HIGH BEAUTY ACTIVE POWDE0859
Shiseido Benefique Bounce Genius,9586,1,Beauty/Cosmetics,SHISEIDO BENEFIQUE BOUNCE GENIUS0860
Ikemoto Seduce A.P Brushing Brush Red,620,1,Hair Care Brush,IKEMOTO SEDUCE A.P BRUSHING BRUSH RED0861
Uskin Pharmaceutical Uskin Bottle 120g,878,1,Health_Supplement,USKIN PHARMACEUTICAL USKIN BOTTLE 120G0862
Fino Premium Touch Penetrating Beauty Liquid Hair Mask,757,1,Hair Care,FINO PREMIUM TOUCH PENETRATING BEAUTY LIQUID H0863
Kaxa Lift S Microcurrent Facial Toner Device,5800,2,Beauty Device,KAXA LIFT S MICROCURRENT FACIAL TONER DEVICE0864
LebeL Luber Material G Brown Shade Brown 1 Piece B-6G 120g,690,3,Cosmetics,LEBEL LUBER MATERIAL G BROWN SHADE BROWN 1 PIE0865
Fumakiller Allergy Block Mist Type,823,1,Healthcare,FUMAKILLER ALLERGY BLOCK MIST TYPE0866
Shiseido Professional Adenovital Eye Lash Serum 6g,1344,6,Beauty/Cosmetics,SHISEIDO PROFESSIONAL ADENOVITAL EYE LASH SERU0867
Dasock B Herbal Cough Medicine 80 Tablets x 3 Set,6750,3,Health Supplement,DASOCK B HERBAL COUGH MEDICINE 80 TABLETS X 3 0868
Deep Sea Shark Liver Oil Capsules,1931,1,Health Supplement,DEEP SEA SHARK LIVER OIL CAPSULES0869
Luber Io Recomin Root Supplement Treatment 1000ml Refill Replacement,3010,1,Hair Care,LUBER IO RECOMIN ROOT SUPPLEMENT TREATMENT 1000870
Lubel Io Ricomint Cleansing Icy Shampoo 1000ml Refill Replacement,3010,1,Hair Care,LUBEL IO RICOMINT CLEANSING ICY SHAMPOO 1000ML0871
Luber Io Essence Forte 100mL,1430,1,Hair Care,LUBER IO ESSENCE FORTE 100ML0872
Luber Io Essence Moist 100ml,1425,1,Hair Care,LUBER IO ESSENCE MOIST 100ML0873
Lubel Io Essence Sleek 100mL,1425,1,Hair Care,LUBEL IO ESSENCE SLEEK 100ML0874
Lebel Pro Edit Careworks CMC Refill Hair Treatment 500ml,3102,1,Hair Care,LEBEL PRO EDIT CAREWORKS CMC REFILL HAIR TREAT0875
Lebel Pro Edit Careworks NMF (Refill/500ml) Hair Care Treatment,3102,1,Hair Care,LEBEL PRO EDIT CAREWORKS NMF (REFILL/500ML) HA0876
Lebel IAU Cell Care 3S Refill for Hair Treatment (1000ml),4180,1,Hair Care,LEBEL IAU CELL CARE 3S REFILL FOR HAIR TREATME0877
Lebel IAU Cell Care 4 Refill 1000ml Hair Treatment,3410,1,Hair Care,LEBEL IAU CELL CARE 4 REFILL 1000ML HAIR TREAT0878
Lebel IAU Cell Care 3M Refill Treatment,4180,1,Hair Care,LEBEL IAU CELL CARE 3M REFILL TREATMENT0879
Lebel IAU Cell Care 2 Refill 500ml Hair Care Treatment,3740,1,Hair Care,LEBEL IAU CELL CARE 2 REFILL 500ML HAIR CARE T0880
Lebel Proedit Float Cleansing Shampoo,1027,2,Hair Care,LEBEL PROEDIT FLOAT CLEANSING SHAMPOO0881
Lebel IAU Cell Care Refill 1000ml Hair Care Treatment,2970,1,Hair Care,LEBEL IAU CELL CARE REFILL 1000ML HAIR CARE TR0882
Lebel Pro Edit Careworks Element Fix Refill 500ml Hair Care Treatment,3102,1,Hair Care,LEBEL PRO EDIT CAREWORKS ELEMENT FIX REFILL 500883
Lebel Pro Edit Careworks PPT Refill 500ml Hair Care Treatment,3102,1,Hair Care,LEBEL PRO EDIT CAREWORKS PPT REFILL 500ML HAIR0884
PureMask Grey Regular Size 15pcs (5packs x 3pcs) Summer Mask Washable Pitta Mask SimilarReusable Economic,1980,1,Healthcare,PUREMASK GREY REGULAR SIZE 15PCS (5PACKS X 3PC0885
Shiseido Serum Noir Non-Whitening Hair Massage Shampoo N 240ml,1887,2,Hair Care,SHISEIDO SERUM NOIR NON-WHITENING HAIR MASSAGE0886
"Shiseido Sercum Noire N Women's Hair Growth Essence 150ml, Special Price Due to Outer Packaging Damage",3198,2,Other,SHISEIDO SERCUM NOIRE N WOMEN'S HAIR GROWTH ES0887
Ikemoto Aging Care Scalp Brush TC1300,1050,5,Health & Beauty,IKEMOTO AGING CARE SCALP BRUSH TC13000888
"Touchi Bean Extract 240 Tablets, Set of 6, Free Shipping",6180,1,Other,"TOUCHI BEAN EXTRACT 240 TABLETS, SET OF 6, FRE0889"
Ikemoto Seduce A.P Brushing Brush Red,620,5,Hair Care Brush,IKEMOTO SEDUCE A.P BRUSHING BRUSH RED0890
Ikemoto Aging Care Scalp Brush TC1300,1050,2,Health & Beauty,IKEMOTO AGING CARE SCALP BRUSH TC13000891
Ikemoto Seduce Hair Brush Blue,620,5,Hair Care,IKEMOTO SEDUCE HAIR BRUSH BLUE0892
Pabron S Gold W Tablets 60,1528,1,Health Supplement,PABRON S GOLD W TABLETS 600893
Orovanine H Ointment 100g,609,1,Pharmaceuticals,OROVANINE H OINTMENT 100G0894
Luber Io Cleansing Clearment 200ml,1232,1,Hair Care,LUBER IO CLEANSING CLEARMENT 200ML0895
"Shiseido Sercum Noire N Women's Hair Growth Essence 150ml, Special Price Due to Outer Packaging Damage",3198,2,Other,SHISEIDO SERCUM NOIRE N WOMEN'S HAIR GROWTH ES0896
"Supplement for Women from 30s, 45-90 Days Supply (3-Piece Set) [FANCL Official]",6400,1,Other,"SUPPLEMENT FOR WOMEN FROM 30S, 45-90 DAYS SUPP0897"
"Medical Device Certified Soft Touch Thermometer for Kids and Babies, Mail Delivery, Anti-Bacterial, Dretec TO-200, Thermal Measurement Case",1480,2,Other,MEDICAL DEVICE CERTIFIED SOFT TOUCH THERMOMETE0898
"Omron Electronic Thermometer MC-687 for Armpit Use, Fast 15-Second Measurement",3264,1,Other,OMRON ELECTRONIC THERMOMETER MC-687 FOR ARMPIT0899
Kaxa Lift S Microcurrent Facial Toner Device,5800,4,Beauty Device,KAXA LIFT S MICROCURRENT FACIAL TONER DEVICE0900
Pabron S Gold W Tablets 60,1528,1,Health Supplement,PABRON S GOLD W TABLETS 600901
Shiseido The Collagen High Beauty Active Powder 126g,1365,1,Health and Beauty Supplement,SHISEIDO THE COLLAGEN HIGH BEAUTY ACTIVE POWDE0902
"Dasmock B 80 Tablets x 5 Set, Seihaito Lung Cleansing Medicine",10695,1,Other,"DASMOCK B 80 TABLETS X 5 SET, SEIHAITO LUNG CL0903"
Perfect Asta Collagen Refill 225g,1404,1,Health_Supplement,PERFECT ASTA COLLAGEN REFILL 225G0904
Paper-thin Kefir Ca+D 120 Tablets New Product Papa Zelly by Oak Pharmaceuticals Same-Day Ship,1383,6,Supplements,PAPER-THIN KEFIR CA+D 120 TABLETS NEW PRODUCT 0905
"Papazell 5, 120 Tablets, 2nd Class Medication",1650,1,Other,"PAPAZELL 5, 120 TABLETS, 2ND CLASS MEDICATION0906"
Shiseido Elixir Superieur Sleeping Gel Pack W 105g (Gel Pack),2536,3,Skincare,SHISEIDO ELIXIR SUPERIEUR SLEEPING GEL PACK W 0907
Shiseido Elixir Superieur Lift Night Cream W 40g,4580,1,Skin Care,SHISEIDO ELIXIR SUPERIEUR LIFT NIGHT CREAM W 40908
Shiseido Adenovital Shampoo,1570,3,Hair Care,SHISEIDO ADENOVITAL SHAMPOO0909
Ayura Kassha Massage Premium Ceramic Plate,3079,1,Health & Beauty,AYURA KASSHA MASSAGE PREMIUM CERAMIC PLATE0910
Allergy Block Mist,600,1,Healthcare,ALLERGY BLOCK MIST0911
Shiseido Adenovital Eye Lash Serum,1346,5,Beauty_and_Skincare,SHISEIDO ADENOVITAL EYE LASH SERUM0912
【50% OFF】Beautiful Princess Exfoliating Scrub Liberta V-Line Anti-Blackheads [Princess Series] himecoto Dark Spot Hyaluronic Acid Removes Old Keratin Dirt Moisturizes Bikini Line,632,1,Beauty/Cosmetics,【50% OFF】BEAUTIFUL PRINCESS EXFOLIATING SCRUB 0913
AHA Cleansing Research Clear Lotion 3-Piece Set with Free Shipping,3157,1,Beauty/Skincare,AHA CLEANSING RESEARCH CLEAR LOTION 3-PIECE SE0914
"Touchi Bean Extract 240 Tablets, Set of 6, Free Shipping",5560,1,Other,"TOUCHI BEAN EXTRACT 240 TABLETS, SET OF 6, FRE0915"
Youth Skin A 120g,831,1,Health_Supplement,YOUTH SKIN A 120G0916
Maruman Shark Cartilage Granules 90 pieces 2% OFF Coupon until 9/5 23:59,2025,1,Health Supplement,MARUMAN SHARK CARTILAGE GRANULES 90 PIECES 2% 0917
Slim Up Slim Veggie Full Red Smoothie Berry Yogurt Flavor 300g,1470,1,Health Supplement,SLIM UP SLIM VEGGIE FULL RED SMOOTHIE BERRY YO0918
Collagen Tripeptide Spirulina Marine Collagen Low MolecularWeight Collagen Supplement Skin Care Fasting Diet Whole Food Protein Rich Health Food,1250,1,Health Supplement,COLLAGEN TRIPEPTIDE SPIRULINA MARINE COLLAGEN 0919
Kobayashi Pharmaceutical Whitening Smigaki Floral Mint 90g,468,5,Health and Beauty,KOBAYASHI PHARMACEUTICAL WHITENING SMIGAKI FLO0920
Kao Biore U Foamy Body Wash Angel Rose Fragrance Pump 600ml,583,4,Beauty & Personal Care,KAO BIORE U FOAMY BODY WASH ANGEL ROSE FRAGRAN0921
Rohto Pharmaceutical Deoco Medicinal Deodorant Roll-On 30ml,715,8,Health and Beauty,ROHTO PHARMACEUTICAL DEOCO MEDICINAL DEODORANT0922
Dasmock B 80 Tablets x 5 Set Seihaito Clear Lung Tonic,10695,1,Health Supplement,DASMOCK B 80 TABLETS X 5 SET SEIHAITO CLEAR LU0923
Stock Limited [Designated OTC Medicine] YouSkin A Service Pack 120g+12g,836,7,Health_Supplement,STOCK LIMITED [DESIGNATED OTC MEDICINE] YOUSKI0924
Lubel Io Cell Care Refill 1000ml,2633,1,Hair Care,LUBEL IO CELL CARE REFILL 1000ML0925
