product_name,price,stock,category_name,sku
Rakuten Super Sale Shiseido Adenovital Scalp Treatment 130g x 2pcs [SBT],2269,3,Hair Care,RAKUTEN SUPER SALE SHISEIDO ADENOVITAL SCALP T0000
Snowboard Wear Mens Ladies Set Snowboard Ski Jacket Pants MTU Unisex 13 Colors Black White 6 Sizes XS-XXL,16940,1,Sports Equipment & Apparel,SNOWBOARD WEAR MENS LADIES SET SNOWBOARD SKI J0001
Snowboard Wear Mens Ladies Set Snowboard Ski Jacket Pants MTU Unisex 13 Colors Black White 6 Sizes XS-XXL,16940,1,Sports Equipment & Apparel,SNOWBOARD WEAR MENS LADIES SET SNOWBOARD SKI J0002
New Biofermin S Tablets 350,1579,1,Supplement,NEW BIOFERMIN S TABLETS 3500003
Shiseido Facial Cleansing Specialist Speedy Perfect Whip Moist Touch 150mL (Foam Cleanser Moist),593,1,Skincare,SHISEIDO FACIAL CLEANSING SPECIALIST SPEEDY PE0004
Free Shipping ★ Tokio Inkarami Head Spa Shampoo 500ml Salon Exclusive Product 【Dr. Junior Tokio Inkarami Head Spa】,6300,1,Hair Care,FREE SHIPPING ★ TOKIO INKARAMI HEAD SPA SHAMPO0005
Swarovski White Necklace Accessory,13090,1,Jewelry,SWAROVSKI WHITE NECKLACE ACCESSORY0006
Pill Box Japan Onaka 60 Tablets (Shipping May Take a Few Days),1278,2,Healthcare,PILL BOX JAPAN ONAKA 60 TABLETS (SHIPPING MAY 0007
Adenovital Eyelash Serum,1330,1,Beauty_and_Personal_Care,ADENOVITAL EYELASH SERUM0008
Orihiro Deep Sea Shark Extract Capsule Value Pack 360 Tablets,1971,1,Health Supplements,ORIHIRO DEEP SEA SHARK EXTRACT CAPSULE VALUE P0009
Soy Isoflavone Plus 90 Days Supply,4320,1,Supplement,SOY ISOFLAVONE PLUS 90 DAYS SUPPLY0010
"Smooth Clear AC 60-Day Supply [FANCL Official] Vitamin B, Vitamin C, Lactic Acid Bacteria, Soy Isoflavone, Chestnut Rose Extract, Zinc for Women's Beauty and Health Supplement",3562,1,Other,SMOOTH CLEAR AC 60-DAY SUPPLY [FANCL OFFICIAL]0011
KIDS IQ Supplement 100 Tablets,1065,1,Health_Supplement,KIDS IQ SUPPLEMENT 100 TABLETS0012
BLACK FRIDAY Limited 2% OFF Coupon & Up to 44x Points  Free Shipping 3-Piece Set Spa Treatment HAS Stretch Sheet 60 Sheets Domestic Authentic Product Spa Treatment HAS Stretch Eye Mask for Puffy Eyes Best Seller,8300,1,Beauty_and_Skincare,BLACK FRIDAY LIMITED 2% OFF COUPON & UP TO 44X0013
"Natto Kinase Supplement [Set of 3] with Monacolin, Quercetin, Natto Kinase, and Garlic Extract",4660,2,Other,NATTO KINASE SUPPLEMENT [SET OF 3] WITH MONACO0014
"Scalp Care Machine, Massage, Hair Growth, Red Light EMS RF Heat, Hair Loss Treatment, Unisex, Gift for Elderly Day, Free Shipping, 1 Year Warranty, Brilliant Hair Mini",4980,5,Other,"SCALP CARE MACHINE, MASSAGE, HAIR GROWTH, RED 0015"
ReFa CARAT RAY FACE RFRF2121B Facial Lifting Massager,9200,5,Beauty & Personal Care,REFA CARAT RAY FACE RFRF2121B FACIAL LIFTING M0016
Touchi Bean Extract Pills 240 Tablets 6 Sets Free Shipping,6174,3,Health Supplements,TOUCHI BEAN EXTRACT PILLS 240 TABLETS 6 SETS F0017
Shiseido Aqua Label Special Gel Cream A (White) 90g Non-Prescription Medicinal Product,1584,6,Skincare,SHISEIDO AQUA LABEL SPECIAL GEL CREAM A (WHITE0018
Shiseido Aqua Label Special Gel Cream N (Moist) 90g,1584,6,Skincare,SHISEIDO AQUA LABEL SPECIAL GEL CREAM N (MOIST0019
"Natto Kinase Supplement with MonacoLin, Quercetin, and Garlic Extract",4660,3,Other,"NATTO KINASE SUPPLEMENT WITH MONACOLIN, QUERCE0020"
Kose Lift Glow Cream 40g,3603,2,Skincare,KOSE LIFT GLOW CREAM 40G0021
LECHERI Lusheri Lift Glow Lotion Moist 160ml,2670,1,Skincare,LECHERI LUSHERI LIFT GLOW LOTION MOIST 160ML0022
Lusheri Lift Glow Emulsion II Moisturizing (120ml),3300,1,Skincare,LUSHERI LIFT GLOW EMULSION II MOISTURIZING (120023
L'Cheri Lift Glow Emulsion I Moisturizing (120ml),3300,1,Skincare,L'CHERI LIFT GLOW EMULSION I MOISTURIZING (1200024
Pill Box Japan Onaka 60 Tablets (Shipping May Take a Few Days),1278,2,Healthcare,PILL BOX JAPAN ONAKA 60 TABLETS (SHIPPING MAY 0025
Tokio SPA First 500g System Treatment,9250,1,Hair Care,TOKIO SPA FIRST 500G SYSTEM TREATMENT0026
TOKIO System Treatment 0 1000ml Dr. Junior,9000,1,Hair Care,TOKIO SYSTEM TREATMENT 0 1000ML DR. JUNIOR0027
Doctor Junior Tokio TOKIO 1 System Treatment 1000mL Tokio Inkarami 1 Adhesion Bonding Type Treatment,11988,1,Hair Care,DOCTOR JUNIOR TOKIO TOKIO 1 SYSTEM TREATMENT 10028
TOKIO Inkarami Salon System 2M Moisture Retention Color Treatment,9020,1,Hair Care,TOKIO INKARAMI SALON SYSTEM 2M MOISTURE RETENT0029
Doctor Junior Tokio 4M System Treatment 250g Tokio Inkarami Bonding Hair Treatment,5398,1,Hair Care,DOCTOR JUNIOR TOKIO 4M SYSTEM TREATMENT 250G T0030
Doctor Junior Tokio 3M System Treatment Inkarami 1000g,9380,1,Hair Care,DOCTOR JUNIOR TOKIO 3M SYSTEM TREATMENT INKARA0031
"Orihiro Happy Life Declaration 180 Tablets, 60 Day Supply Clearance Sale",1931,5,Other,"ORIHIRO HAPPY LIFE DECLARATION 180 TABLETS, 600032"
Folic Acid Iron Calcium Enriched Spirulina DHA & Vitamin C 1200 Tablets Approx. 40 Days Supply Monoglutamic Acid Type Folic Acid Fasting Diet Protein Rich Health Food,2116,4,Supplements,FOLIC ACID IRON CALCIUM ENRICHED SPIRULINA DHA0033
Large 98L Lightweight Suitcase with TSA Lock and 8 Wheels,6980,1,Luggage,LARGE 98L LIGHTWEIGHT SUITCASE WITH TSA LOCK A0034
Seduce Blue Brush SEN-705 Massaging Hair Care Brush,554,8,Hair Care,SEDUCE BLUE BRUSH SEN-705 MASSAGING HAIR CARE 0035
"Spirulina Coenzyme Q10 1200 Tablets, 30-Day Supply for Athletes, Multivitamin Supplement with Amino Acids, Alkaline Food, Nucleic Acid, Fasting Diet, High-Protein Health Food",2116,5,Other,"SPIRULINA COENZYME Q10 1200 TABLETS, 30-DAY SU0036"
"Marathon Limited Half Price Facial Steamer Water Peeling Aquarufa, Pore Care for Blackheads, Acne, and Open Pores with Just Water",3990,2,Other,MARATHON LIMITED HALF PRICE FACIAL STEAMER WAT0037
"Paperzy 5, 120 Tablets, Set of 5, Free Shipping, Prescription Medication Class 2",7480,1,Other,"PAPERZY 5, 120 TABLETS, SET OF 5, FREE SHIPPIN0038"
Anessa Perfect UV Skin Care BB Foundation a 2,1848,3,Cosmetics,ANESSA PERFECT UV SKIN CARE BB FOUNDATION A 20039
Limited Quantity Lucky Bag Honey by Belulu Rebirth B2 Advance Gold 3-Piece Set Skincare Cosmetics Moisturizing Cream Facial Steamer,9999,1,Skincare Set,LIMITED QUANTITY LUCKY BAG HONEY BY BELULU REB0040
Belulu Triple Rich Booster Facial Toning Device,2980,3,Skin Care Device,BELULU TRIPLE RICH BOOSTER FACIAL TONING DEVIC0041
USkin Pharma USkin Cisora Cream Bottle 110g,900,5,Skincare/Cosmetics,USKIN PHARMA USKIN CISORA CREAM BOTTLE 110G0042
Challenge Low Price 1890 JPY per Piece Orihiro High Purity Glucosamine Chondroitin Low Molecular Hyaluronic Acid 270 Tablets 30 Days Supply 2 Pieces Orihiro Supplement for Women and Men Summer Fatigue Diet Hyaluronic Acid Lowest Price,3780,2,Supplement,CHALLENGE LOW PRICE 1890 JPY PER PIECE ORIHIRO0043
Kotaro Traditional Medicine Kurenkan Extract Tablets N (150 tablets),1948,5,Health Supplement,KOTARO TRADITIONAL MEDICINE KURENKAN EXTRACT T0044
Fossil Gen 5E Smartwatch for Men,12760,1,Electronics,FOSSIL GEN 5E SMARTWATCH FOR MEN0045
Lebel Pro Edit Careworks PPT NMF CMC Element Fix Set (150ml each) Hair Care Treatment Salon Exclusive Product,4730,1,Hair Care,LEBEL PRO EDIT CAREWORKS PPT NMF CMC ELEMENT F0046
Lebel Pro Edit Careworks Element Fix PPT NMF CMC Hair Care Treatment Nozzle,132,1,Hair Care,LEBEL PRO EDIT CAREWORKS ELEMENT FIX PPT NMF C0047
Lebel Pro Edit Careworks Element Fix PPT NMF CMC Trigger,198,3,Hair Care,LEBEL PRO EDIT CAREWORKS ELEMENT FIX PPT NMF C0048
Lubel Rocole Serum Color 300g Ivory,1610,1,Hair Care,LUBEL ROCOLE SERUM COLOR 300G IVORY0049
Luber Lucias 150g (Clear CLR),1270,1,Hair Care,LUBER LUCIAS 150G (CLEAR CLR)0050
Elixcell Revita Lotion 500ml with Human Stem Cell Extract,5460,1,Skincare,ELIXCELL REVITA LOTION 500ML WITH HUMAN STEM C0051
Acne Mite and Demodex Soap AIDSOAP for Whole Body,1650,1,Health and Beauty,ACNE MITE AND DEMODEX SOAP AIDSOAP FOR WHOLE B0052
KIDS IQ Supplement (150 Tablets) Morikawa Health Store,1413,1,Health Supplement,KIDS IQ SUPPLEMENT (150 TABLETS) MORIKAWA HEAL0053
"Smooth Clear AC 60-Day Supply [FANCL Official] Vitamin B, Vitamin C, Lactic Acid Bacteria, Soy Isoflavone, Chestnut Rose Extract, Zinc for Women's Beauty and Health Supplement",3562,1,Other,SMOOTH CLEAR AC 60-DAY SUPPLY [FANCL OFFICIAL]0054
Adult Calorie Limit FANCL Approx. 90 Servings 1 Bag 90 Pieces x 3 Bags Set FANCL Diet Supplement,6750,1,Dietary Supplements,ADULT CALORIE LIMIT FANCL APPROX. 90 SERVINGS 0055
Maruman Shark Cartilage Granules 90 pieces,2025,1,Health Supplement,MARUMAN SHARK CARTILAGE GRANULES 90 PIECES0056
Limited Edition Belulu Rebirth Skin Care Set with Honey Placenta Mask and Cream,9999,1,Skincare,LIMITED EDITION BELULU REBIRTH SKIN CARE SET W0057
New Biofermin S Tablets 350,1579,1,Supplement,NEW BIOFERMIN S TABLETS 3500058
Transein Whitening CC Cream Natural Multi Beige 30g,2268,2,Cosmetics,TRANSEIN WHITENING CC CREAM NATURAL MULTI BEIG0059
GH Creation EX+ Height Growth Supplement,3450,1,Health_Supplement,GH CREATION EX+ HEIGHT GROWTH SUPPLEMENT0060
Relax Bee Neck Massager EMS Shoulder Relief Heated Health Care Gift,9584,1,Health and Beauty,RELAX BEE NECK MASSAGER EMS SHOULDER RELIEF HE0061
Quick & Easy Straight Hair Brush,3780,1,hair_care,QUICK & EASY STRAIGHT HAIR BRUSH0062
Belulu Triple Rich Booster Facial Toning Device,2980,3,Skin Care Device,BELULU TRIPLE RICH BOOSTER FACIAL TONING DEVIC0063
Water-Soluble Agaricus | Orikhiro | 432 Tablets x 4 Set,13380,1,Health Supplement,WATER-SOLUBLE AGARICUS | ORIKHIRO | 432 TABLET0064
"Natto Kinase Supplement with MonacoLin, Quercetin, Garlic Extract, 240 Tablets, 8 Tablets per Day",4660,2,Other,"NATTO KINASE SUPPLEMENT WITH MONACOLIN, QUERCE0065"
Touchi Bean Extract Pills 240 Tablets 6 Sets Free Shipping,6174,1,Health Supplements,TOUCHI BEAN EXTRACT PILLS 240 TABLETS 6 SETS F0066
"Uzu Lip Treatment 38°C/99°F Clear Lip Balm ±0, Low Irritation, No Colorant, Hypoallergenic",1000,1,Other,"UZU LIP TREATMENT 38°C/99°F CLEAR LIP BALM ±0,0067"
Lebel Cool Orange Scalp Conditioner 240g Nozzle,132,7,Hair Care,LEBEL COOL ORANGE SCALP CONDITIONER 240G NOZZL0068
Lebel Cool Orange Scalp Conditioner Mild Type,1276,8,Hair Care,LEBEL COOL ORANGE SCALP CONDITIONER MILD TYPE0069
Rush Pure Premium Peeling Gel Set,3080,5,Beauty/Skincare,RUSH PURE PREMIUM PEELING GEL SET0070
Bijou De Mer Reludo Face Renewal Serum,3750,2,Skincare,BIJOU DE MER RELUDO FACE RENEWAL SERUM0071
Omega 3 DHA EPA Alpha Linolenic Acid Supplement (Approx. 3 Months Supply),1000,5,Supplements,OMEGA 3 DHA EPA ALPHA LINOLENIC ACID SUPPLEMEN0072
New Release Scalp Care Machine【Miruru Brilliant Hair Mini】Gift for Father's Day Scalp Massage Scalp Care Hair Care Scalp Stimulation Red LED EMS RF Thermal Hair Growth Hair Loss Hair Removal AGA Unisex【Free Shipping・Return Guarantee・1 Year Warranty】,7980,2,Hair Care Device,NEW RELEASE SCALP CARE MACHINE【MIRURU BRILLIAN0073
Deep Sea Shark Excapsule Value Pack 360 Capsules (12 Sets) 2 Months Supply,24000,1,Health Supplement,DEEP SEA SHARK EXCAPSULE VALUE PACK 360 CAPSUL0074
DHC Easy 30-Day Supply (180 Tablets),1380,1,Supplements,DHC EASY 30-DAY SUPPLY (180 TABLETS)0075
"Kyoto Flower Dance Umbrella ""Sakura Shizuku 3-Fold Folding Umbrella""",2380,1,Accessories,"KYOTO FLOWER DANCE UMBRELLA ""SAKURA SHIZUKU 3-0076"
"Kids' Cod Liver Oil Vitamin Drop Jelly Strawberry Flavor 60 Pieces ""5% OFF for First-Time Buyers"" ""Our Store's Exclusive Discount 300 Yen Off""",1201,1,Health Supplements,KIDS' COD LIVER OIL VITAMIN DROP JELLY STRAWBE0077
Max Hyaluronic Acid 8 Piece Set Beauty Supplement with Hyaluronic Acid and Collagen,9288,1,Health Supplement,MAX HYALURONIC ACID 8 PIECE SET BEAUTY SUPPLEM0078
30% Off Outlet Fragrance Supplement KAORU Vibrant Rose x 5 Set Refining Adult Scent Anti-Halitosis,2268,3,Health Supplement,30% OFF OUTLET FRAGRANCE SUPPLEMENT KAORU VIBR0079
Kaoru Rose Vanilla Refreshing Fragrance Supplements (20 pieces),530,1,Health Supplement,KAORU ROSE VANILLA REFRESHING FRAGRANCE SUPPLE0080
Shiseido Pro Fente Forte Sea Bum Clear Gel A 150g C ×2 Set,2820,1,Skincare,SHISEIDO PRO FENTE FORTE SEA BUM CLEAR GEL A 10081
Shiseido Pro Adenovital Shampoo 250ml × 5 Set,7680,4,Hair Care,SHISEIDO PRO ADENOVITAL SHAMPOO 250ML × 5 SET0082
Maruman Shark Cartilage Granules 90 pieces,2025,1,Health Supplement,MARUMAN SHARK CARTILAGE GRANULES 90 PIECES0083
"""300 Yen Off with Coupon"" Thick Sole Slip On Sneakers for Women with Wide Toe Box and Anti-Blister Design, Comfortable Walking Shoes, Lightweight and Warm, Non-Slip Winter Sneakers",3280,1,Other,"""300 YEN OFF WITH COUPON"" THICK SOLE SLIP ON S0084"
Acne Mite Soap Aid,1650,1,Health and Beauty,ACNE MITE SOAP AID0085
Hepalyse Plus II 180 Tablets x 2 Set,7920,1,Supplements,HEPALYSE PLUS II 180 TABLETS X 2 SET0086
Kaminomoto Medicated Shampoo B&P (HG) 300ml,1180,5,Hair Care,KAMINOMOTO MEDICATED SHAMPOO B&P (HG) 300ML0087
"Comfortable Walking Sneakers for Women with Wide Toe Box and Anti-Blister Design, Lightweight and Warm, 10% Off with Coupon",3280,1,Other,COMFORTABLE WALKING SNEAKERS FOR WOMEN WITH WI0088
Tokio SPA First 500g System Treatment,9250,1,Hair Care,TOKIO SPA FIRST 500G SYSTEM TREATMENT0089
KIDS IQ Supplement (150 Tablets) Morikawa Health Store,1413,1,Health Supplement,KIDS IQ SUPPLEMENT (150 TABLETS) MORIKAWA HEAL0090
Transein Whitening CC Cream Natural Multi Beige 30g,2268,2,Cosmetics,TRANSEIN WHITENING CC CREAM NATURAL MULTI BEIG0091
"Scalp Care Machine Brilliant Hair - 50% OFF Award-Winning Head Massager for Hair Loss & Regrowth with Laser, LED, EMS, Heat, Free Shipping & 1-Year Warranty",17400,1,Other,SCALP CARE MACHINE BRILLIANT HAIR - 50% OFF AW0092
New Release Scalp Care Machine【Miruru Brilliant Hair Mini】Gift for Father's Day Scalp Massage Scalp Care Hair Care Scalp Stimulation Red LED EMS RF Thermal Hair Growth Hair Loss Hair Removal AGA Unisex【Free Shipping・Return Guarantee・1 Year Warranty】,7980,1,Hair Care Device,NEW RELEASE SCALP CARE MACHINE【MIRURU BRILLIAN0093
Kotaro Traditional Japanese Medicine Extract Tablets N,1948,5,Health Supplement,KOTARO TRADITIONAL JAPANESE MEDICINE EXTRACT T0094
Lubel Io Essence Sleek 100mL,1300,2,Hair Care,LUBEL IO ESSENCE SLEEK 100ML0095
Adenovital Eyelash Serum,1330,1,Beauty_and_Personal_Care,ADENOVITAL EYELASH SERUM0096
Shiseido Elixir Superieur Tsuba Tama Mist 80ml [Beauty Lotion Mist],1590,1,Beauty & Personal Care,SHISEIDO ELIXIR SUPERIEUR TSUBA TAMA MIST 80ML0097
Shiseido Elixir Superieur Smooth Gel Wash 105g Facial Cleanser,1580,1,Skincare,SHISEIDO ELIXIR SUPERIEUR SMOOTH GEL WASH 105G0098
Shiseido Elixir Superieur Moist In Cleansing 140ml Facial Cleanser,1580,1,Skincare,SHISEIDO ELIXIR SUPERIEUR MOIST IN CLEANSING 10099
Shiseido Elixir Superieur Lift Night Cream W 40g,4580,3,Skin Care,SHISEIDO ELIXIR SUPERIEUR LIFT NIGHT CREAM W 40100
Dasmon B 80 Tablets x 5,10560,1,Health Supplement,DASMON B 80 TABLETS X 50101
Natto Kinase Supplement with Monacolin and Quercetin [3-Pack],4660,4,Health Supplement,NATTO KINASE SUPPLEMENT WITH MONACOLIN AND QUE0102
Formal Silk Folding Fan Set with Case,990,1,Accessories,FORMAL SILK FOLDING FAN SET WITH CASE0103
Fine Today Shiseido Facial Cleansing Specialist Foam Cleanser Removable Makeup 150ml,749,1,Skincare,FINE TODAY SHISEIDO FACIAL CLEANSING SPECIALIS0104
Fine Today Shiseido TSUBAKI Premium Repair Mask 180g,998,5,Hair Care,FINE TODAY SHISEIDO TSUBAKI PREMIUM REPAIR MAS0105
Fine Today Shiseido Fino Premium Touch Penetrating Beauty Liquid Hair Mask 230g,752,1,Hair Care,FINE TODAY SHISEIDO FINO PREMIUM TOUCH PENETRA0106
Lebel Pro Edit Hair Skin Float Cleansing 250mL Commercial Use,978,2,Hair Care,LEBEL PRO EDIT HAIR SKIN FLOAT CLEANSING 250ML0107
Lebel IAU Salon Exclusive Hair Care Refill 1000mL with Up to ¥2000 Coupon,3317,1,Hair Care,LEBEL IAU SALON EXCLUSIVE HAIR CARE REFILL 1000108
LebeL IAU Salon Exclusive Hair Care 1000mL Refill with Up to 2000 Yen Coupon,4740,1,Hair Care,LEBEL IAU SALON EXCLUSIVE HAIR CARE 1000ML REF0109
Lebel IAU Essence Moist 100mL Non-Rinse Treatment Salon Exclusive Hair Care,1552,1,Hair Care,LEBEL IAU ESSENCE MOIST 100ML NON-RINSE TREATM0110
Rebel Iau Cleansing Clearment Shampoo 1000mL (Refill) Non-Silicone Shampoo,3960,1,Hair Care,REBEL IAU CLEANSING CLEARMENT SHAMPOO 1000ML (0111
LebeL IAU Salon Exclusive Hair Care Refill 1000mL with up to 2000 Yen Coupon,3792,1,Hair Care,LEBEL IAU SALON EXCLUSIVE HAIR CARE REFILL 1000112
LebeL IAU Salon Exclusive Hair Care 1000mL Refill with Up to ¥2000 Coupon until 9/24,4740,1,Hair Care,LEBEL IAU SALON EXCLUSIVE HAIR CARE 1000ML REF0113
LebeL IAU Salon Exclusive Hair Care Refill 500mL with Coupon Up to ¥2000 Off,4265,1,Hair Care,LEBEL IAU SALON EXCLUSIVE HAIR CARE REFILL 5000114
Lubel Pro Edit Careworks CMC Refill 500mL,3086,1,Hair Care,LUBEL PRO EDIT CAREWORKS CMC REFILL 500ML0115
Maruman Shark Cartilage Granules 90 pieces,2025,1,Health Supplement,MARUMAN SHARK CARTILAGE GRANULES 90 PIECES0116
Natto Kinase Supplement with Monacolin and Quercetin Extract,4660,3,Health_Supplement,NATTO KINASE SUPPLEMENT WITH MONACOLIN AND QUE0117
Kaminosato Pharmaceutical Hair Conditioner B&P 300ml,1184,1,Hair Care,KAMINOSATO PHARMACEUTICAL HAIR CONDITIONER B&P0118
Kaminosho Pharmacy Use Shampoo B&P 300ml,1184,5,Hair Care,KAMINOSHO PHARMACY USE SHAMPOO B&P 300ML0119
Folic Acid Iron Calcium Enriched Spirulina DHA & Vitamin C 1200 Tablets Approx. 40 Days Supply Monoglutamic Acid Type Folic Acid Fasting Diet Protein Rich Health Food,2116,2,Supplements,FOLIC ACID IRON CALCIUM ENRICHED SPIRULINA DHA0120
Lion Oct Shampoo 320ml,398,5,Hair Care,LION OCT SHAMPOO 320ML0121
Octo Serapi Medicated Skin Care Shampoo,876,5,Health and Beauty,OCTO SERAPI MEDICATED SKIN CARE SHAMPOO0122
7 Color Set Women's Lace Shorts 7 Pack Stress Free Simple Maternity Comfortable Basic Underwear,1780,1,Women's Clothing,7 COLOR SET WOMEN'S LACE SHORTS 7 PACK STRESS 0123
Shiseido Elixir Superieur Lift Night Cream W 40g,4580,2,Skin Care,SHISEIDO ELIXIR SUPERIEUR LIFT NIGHT CREAM W 40124
Shiseido Elixir Superieur Sleeping Gel Pack W 105g,2536,2,Skincare,SHISEIDO ELIXIR SUPERIEUR SLEEPING GEL PACK W 0125
KIDS IQ Supplement (150 Tablets) Morikawa Health Store,1419,1,Health Supplement,KIDS IQ SUPPLEMENT (150 TABLETS) MORIKAWA HEAL0126
Shiseido Adenovital Shampoo 250mL (Non-Pharmaceutical),1589,5,Hair Care,SHISEIDO ADENOVITAL SHAMPOO 250ML (NON-PHARMAC0127
Plexus Rookie 3D Maze Game Toy,2728,1,Toys & Games,PLEXUS ROOKIE 3D MAZE GAME TOY0128
Ultra Lightweight Carry-On Luggage 34L,3580,1,Travel Accessories,ULTRA LIGHTWEIGHT CARRY-ON LUGGAGE 34L0129
Max Hyaluronic Acid 8 Piece Set Beauty Supplement with Hyaluronic Acid and Collagen,9288,2,Health Supplement,MAX HYALURONIC ACID 8 PIECE SET BEAUTY SUPPLEM0130
Lactis Probiotics Supplement BioGenics Lactic Acid Bacteria Drink Flora Microorganism Active Bacteria Dead Bacteria Japan Made for Pregnant Women Maternity Kids Baby Tofu Milk Beauty Health Drink Refreshing Lemon Flavor 30 Days 10ml 30 Packs,7800,4,Health Supplement,LACTIS PROBIOTICS SUPPLEMENT BIOGENICS LACTIC 0131
"Unlabel Lab PL Essence Placenta 50mL, High-Pressure Infusion Concentrated Beauty Serum",1540,4,Other,"UNLABEL LAB PL ESSENCE PLACENTA 50ML, HIGH-PRE0132"
"Kyoto Flower Dance Umbrella ""Sakura Shizuku 3 Fold"" Luxury Folding Umbrella with Sakura Pattern Appearing when Wet",2140,1,Home & Garden,"KYOTO FLOWER DANCE UMBRELLA ""SAKURA SHIZUKU 3 0133"
Super Sale Limited 50% OFF Ranking 1st Award Winning Scalp Care Machine Beauty Lulu Brilliant Hair Gift Head Massage Scalp Care Hair Loss Hair Care Laser LED EMS Heat Hair Growth Hair Loss Treatment AGA [Free Shipping Return Guarantee 1 Year Warranty],17400,1,Health & Beauty,SUPER SALE LIMITED 50% OFF RANKING 1ST AWARD W0134
"2% OFF Coupon! 6-Piece Set YouSkin I 110g x 6, Free Shipping, Until 9/5 23:59",5780,2,Other,"2% OFF COUPON! 6-PIECE SET YOUSKIN I 110G X 6,0135"
LANEIGE Water Bank Blue Hyaluronic 2-Step Essential Set,5159,1,Skincare,LANEIGE WATER BANK BLUE HYALURONIC 2-STEP ESSE0136
@Pillbox Japan Onaka 60 Tablets (Shipping may take a few days),1278,2,Health_Supplement,@PILLBOX JAPAN ONAKA 60 TABLETS (SHIPPING MAY 0137
Natto Kinase Supplement with Monaco Lyne and Garlic Extract,4660,3,Health Supplement,NATTO KINASE SUPPLEMENT WITH MONACO LYNE AND G0138
Free Shipping 3-piece Set Spa Treatment HAS Stretchy Eye Mask 60 Sheets Authentic Domestic Product,8300,1,Beauty & Personal Care,FREE SHIPPING 3-PIECE SET SPA TREATMENT HAS ST0139
FANCL Facial Cleansing Powder 2 Pieces,2525,1,Beauty & Personal Care,FANCL FACIAL CLEANSING POWDER 2 PIECES0140
Free Shipping 3-piece Set Spa Treatment HAS Stretchy Eye Mask 60 Sheets Authentic Domestic Product,8300,1,Beauty & Personal Care,FREE SHIPPING 3-PIECE SET SPA TREATMENT HAS ST0141
Collagen Tripeptide Spirulina Marine Collagen Low MolecularWeight Collagen Supplement Skin Care Fasting Diet Whole Food Protein Rich Health Food,2116,2,Health Supplement,COLLAGEN TRIPEPTIDE SPIRULINA MARINE COLLAGEN 0142
Fine Today Shiseido Fino Premium Touch Penetrating Beauty Liquid Hair Mask 230g,752,5,Hair Care,FINE TODAY SHISEIDO FINO PREMIUM TOUCH PENETRA0143
Max Hyaluronic Acid 8 Piece Set Beauty Supplement with Hyaluronic Acid and Collagen,9288,2,Health Supplement,MAX HYALURONIC ACID 8 PIECE SET BEAUTY SUPPLEM0144
"Onaka 60 Tablets x 10 Boxes Set with 500 Yen Off Coupon, Approximately 150 Servings, Pillbox Supplement for Waist, Fat, BMI, and Obesity with Kudzu Flower Functional Display Food",13750,2,Other,ONAKA 60 TABLETS X 10 BOXES SET WITH 500 YEN O0145
Intensive Repair Gel Cream 30g Grace One by KOSE Cosmeport,1024,4,Skincare,INTENSIVE REPAIR GEL CREAM 30G GRACE ONE BY KO0146
FANCL Blood Sugar Support 30-Day Supply x 3 Functional Food,3995,1,Health Supplement,FANCL BLOOD SUGAR SUPPORT 30-DAY SUPPLY X 3 FU0147
Nisitol Za Fat Burning Supplement,4677,1,Health Supplement,NISITOL ZA FAT BURNING SUPPLEMENT0148
Dr. Shi Lab Lab Lab Super Pore Lotion Toner,1232,2,Skincare,DR. SHI LAB LAB LAB SUPER PORE LOTION TONER0149
Pip Slim Walk Cool Long Leggings,1548,3,Clothing,PIP SLIM WALK COOL LONG LEGGINGS0150
Face Mite Solution Soap Set,3300,5,Beauty_and_Personal_Care,FACE MITE SOLUTION SOAP SET0151
"Face Mite Soap 100g, Anti-Acne & Skin Troubles",1650,5,Other,"FACE MITE SOAP 100G, ANTI-ACNE & SKIN TROUBLES0152"
K-Palette Real Lasting Eyepencil 24h WP Super Black & Brown Black Waterproof No Smudge Easy to Apply High Pigmentation Beauty Liquid,1340,1,Beauty & Cosmetics,K-PALETTE REAL LASTING EYEPENCIL 24H WP SUPER 0153
Swatch The Starry Night by Vincent van Gogh Watch,13530,1,Watches,SWATCH THE STARRY NIGHT BY VINCENT VAN GOGH WA0154
Wart Removal Solution 10ml x 3pcs,2269,3,Pharmaceuticals/Skincare,WART REMOVAL SOLUTION 10ML X 3PCS0155
Pip Slim Walk Cool Long Leggings,1548,3,Clothing,PIP SLIM WALK COOL LONG LEGGINGS0156
Natto Kinase Supplement with Monaco Lyne and Garlic Extract,4439,3,Health Supplement,NATTO KINASE SUPPLEMENT WITH MONACO LYNE AND G0157
Rohto Deoco Body Cleanser Refill (250ml),630,8,Beauty/Personal Care,ROHTO DEOCO BODY CLEANSER REFILL (250ML)0158
Shiseido Adenovital Shampoo 250mL (Non-Pharmaceutical),1589,6,Hair Care,SHISEIDO ADENOVITAL SHAMPOO 250ML (NON-PHARMAC0159
"Limited Edition Luxury 4-Piece Beauty Set: belulu Rebirth B2 Advance Gold with Skincare, Cosmetics, and Honey Placenta Mask",9999,1,Other,LIMITED EDITION LUXURY 4-PIECE BEAUTY SET: BEL0160
Belulu Relax-be Neck and Shoulder Massager KRD9013,11980,1,Health & Beauty,BELULU RELAX-BE NECK AND SHOULDER MASSAGER KRD0161
Shiseido Certified Online Shop Shiseido d Program Allerbaria Essence BB N Medium,2299,1,Cosmetics,SHISEIDO CERTIFIED ONLINE SHOP SHISEIDO D PROG0162
"Fat & Uric Acid Down 30 Tablets x 2 Set, Free Shipping by Mail",3530,1,Other,"FAT & URIC ACID DOWN 30 TABLETS X 2 SET, FREE 0163"
Touchi Bean Extract Tablets 240 Tablets 6 Sets Free Shipping,5550,2,Health Supplement,TOUCHI BEAN EXTRACT TABLETS 240 TABLETS 6 SETS0164
【Marathon Shopping 50% OFF】Awarded No.1 Ranking Ultrasonic Water Peeling [Miruru Alpha] Ultrasonic Facial Cleanser Ion Introduction Ion Extraction Blackhead Acne Impurity Removal Moisturizing Beauty Skin Wrinkle Pore Care [Free Shipping & Return Guarante,3990,1,Beauty & Personal Care,【MARATHON SHOPPING 50% OFF】AWARDED NO.1 RANKIN0165
"Unlabel Lab PL Essence Placenta 50mL, High-Pressure Infusion Concentrated Beauty Serum",1540,4,Other,"UNLABEL LAB PL ESSENCE PLACENTA 50ML, HIGH-PRE0166"
Spa Treatment HAS Stretch Seat 60 Sheets Set with 2% Off Coupon and Free Shipping,8300,1,Beauty & Personal Care,SPA TREATMENT HAS STRETCH SEAT 60 SHEETS SET W0167
Pillbox Japan Onaka 60 Tablets (Shipping may take a few days),1278,1,Health Supplements,PILLBOX JAPAN ONAKA 60 TABLETS (SHIPPING MAY T0168
Collagen Tripeptide Spirulina Marine Collagen Low MolecularWeight Collagen Supplement Skin Care Fasting Diet Whole Food Protein Rich Health Food,1400,5,Health Supplement,COLLAGEN TRIPEPTIDE SPIRULINA MARINE COLLAGEN 0169
2% Off All Products Coupon! 【Maruman】 Shark Cartilage Granules 90 pieces,2025,5,Health Supplement,2% OFF ALL PRODUCTS COUPON! 【MARUMAN】 SHARK CA0170
Reversible UV Protection Summer Hat for Women,1290,1,Clothing Accessories,REVERSIBLE UV PROTECTION SUMMER HAT FOR WOMEN0171
L'bel Pro Edit Bounce Fit Shampoo 300ml & Hair Treatment Bounce Fit Plus 250ml Set,2600,1,Hair Care,L'BEL PRO EDIT BOUNCE FIT SHAMPOO 300ML & HAIR0172
Dyson Supersonic Ionic Hair Dryer with Storage Stand Black/Nickel,45760,1,Hair Care Appliances,DYSON SUPERSONIC IONIC HAIR DRYER WITH STORAGE0173
Pillbox Japan Onaka 60 Tablets (Shipping may take a few days),1278,1,Health Supplements,PILLBOX JAPAN ONAKA 60 TABLETS (SHIPPING MAY T0174
KIDS IQ Supplement (150 Tablets) Morikawa Health Store,1462,1,Health Supplement,KIDS IQ SUPPLEMENT (150 TABLETS) MORIKAWA HEAL0175
Dyson Supersonic Ionic Hair Dryer with Storage Stand Black/Nickel,45760,1,Hair Care Appliances,DYSON SUPERSONIC IONIC HAIR DRYER WITH STORAGE0176
"20% OFF Coupon Available - Ladies Necklace, Teardrop Cubic Zirconia, Simple Elegance, Nickel-Free, Pave Gold Silver Drop-Shaped Accessory",1804,1,Other,"20% OFF COUPON AVAILABLE - LADIES NECKLACE, TE0177"
